url_code,time_utc,type,caption,likes,comments
CypDUWEuFaE,2023-10-21 00:53:09,GraphImage,"A federal inspector general has opened an investigation into telework policies that have turned some government offices into ghost towns, risking the spread of disease and raising questions about how agencies deliver services.",59,9
Cyo6vS5Mkf1,2023-10-20 23:38:15,GraphImage,"Most people in the U.S. see Mexico as an essential partner to stop drug trafficking and illegal border crossings, even as they express mixed views of Mexico’s government, according to a new poll.",38,9
Cyop6iTsplV,2023-10-20 21:11:11,GraphImage,"U.S. military personnel and commercial pilots reported at least 291 UFO sightings since August 2022, the Pentagon said in a report released late Wednesday, with some of the craft exhibiting “high-speed travel,” “unusual maneuverability” and other strange characteristics.",26,5
CyohcVogu6B,2023-10-20 19:57:09,GraphImage,"At a time when Americans are deeply divided along party lines, a new poll shows considerable agreement on at least one issue: The United States’ two-decade-long war in Afghanistan was not worth fighting.",42,10
CyoY_DOM2p5,2023-10-20 18:46:09,GraphVideo,"It's more than Republicans versus Democrats out there. We're in a battle for the good of this nation -- against the evil that wants to totally undo this nation. It's more a spiritual war than a political battle that's dividing Americans on so harsh of lines, and once we realize that without God, the war cannot be won, then we can fight more effectively.",47,5
CyoQghuMheC,2023-10-20 17:29:11,GraphImage,"“The data is a reminder that hate never goes away, it only hides,” Mr. Biden said. “Any hate crime is a stain on the soul of America.”",40,4
CyoHsbWMrhT,2023-10-20 16:12:09,GraphImage,"“History has taught us when terrorists don’t pay a price for their terror, when dictators don’t pay a price for their aggression, they cause more chaos and death and more destruction,” Mr. Biden said. “They keep going, and the cost and threats the American people keep rising.”",55,7
Cyn-d_LtUbf,2023-10-20 14:51:41,GraphVideo,"On Friday's Front Page: President Biden laid out his case to the country and Congress that the U.S. must send $100 billion of aid to Israel and Ukraine, Sidney Powell has pleaded guilty to conspiring to interfere with election results, and more.",23,1
CynvNQDs03R,2023-10-20 12:38:11,GraphImage,Fall into digital subscription savings!,18,2
CymfqvxtxVl,2023-10-20 01:03:11,GraphImage,"Breaking Down America's Sweet Tooth 🍬⁠
⁠
How much are Americans planning to spend on Halloween candy this year?",35,6
CymYHtzhR9U,2023-10-19 23:57:13,GraphImage,"China is engaged in a systematic program of military intimidation and coercion involving dangerous jet intercepts of U.S. and allied aircraft that could trigger a U.S.-China conflict, the Pentagon’s senior policymaker for Asia said.",45,13
CymQVSINgRG,2023-10-19 22:49:11,GraphImage,"President Biden is clinging to young voters and making inroads with seniors while former President Donald Trump is attracting middle-aged voters battling inflation and other stressors before retirement, according to early polls that show age is a key indicator of how Americans plan to vote in 2024.",100,31
CymIjUFPPSg,2023-10-19 21:41:18,GraphImage,"Left-wing political commentator Cenk Uygur has joined a growing list of Democratic and liberal challengers to President Biden’s reelection run, and he is challenging the Constitution’s requirement that the president be a natural-born U.S. citizen.⁠
⁠
Mr. Uygur was born in Turkey and became a naturalized U.S. citizen. He created “The Young Turks,” a left-wing news commentary show on YouTube, and co-founded the Justice Democrats political action committee, which works to elect far-left candidates to Congress.",115,24
Cyl5N8rJPXB,2023-10-19 19:27:11,GraphImage,"The IRS is pushing ahead with plans for its own version of a free direct-file option, announcing it will run a 13-state pilot program for next year that will allow a limited number of taxpayers to fill out and submit their tax returns online without having to use a paid service.",65,4
Cylxb3DSxEE,2023-10-19 18:19:11,GraphImage,"Defense Secretary Lloyd Austin on Tuesday issued “prepare to deploy” orders for about 2,000 personnel for possible support of Israel, Pentagon officials said.⁠
⁠
The Defense Department said select military units are in a heightened state of readiness, which improves the Pentagon’s ability to quickly respond to the security situation in the Middle East.",58,6
Cylpps7Avoe,2023-10-19 17:11:10,GraphImage,"Rep. Jim Jordan, the Republicans’ nominee for House speaker, is putting his bid for the gavel on hold after spending days unsuccessfully trying to convince GOP holdouts to back him.⁠
⁠
House Republicans are now debating a backup plan: Voting to give appointed temporary Speaker Patrick McHenry of North Carolina the power to legislate, which he now lacks under the rules of the House.",65,12
Cylh4E1s6gR,2023-10-19 16:03:14,GraphImage,"Kamala Harris’ college tour confronted by the left’s pro-Palestinian young voters⁠
⁠",92,27
CylaVvurBOp,2023-10-19 15:00:43,GraphVideo,"On Thursday's #FrontPage: President Biden walked a diplomatic tightrope on a high-stakes trip to Israel, a federal inspector general has opened an investigation into telework policies that has left some government office buildings vacant, and more.",23,1
CylSiNisHne,2023-10-19 13:49:13,GraphImage,A Capitol Police spokesperson told The Washington Times that three of the demonstrators were arrested and charged with assault on a police officer. ⁠,87,21
CylKjZstKFg,2023-10-19 12:40:39,GraphVideo,"#TopoftheTimes: UAW workers oppose the building of EV plants.

Tune in as The Washington Times' Tim Constantine discusses today's top stories.",31,2
Cyjb-SWsnnR,2023-10-18 20:33:09,GraphImage,"“That Tiktok challenge of how to steal the Kias and Hyundais, that was the biggest thing,” Matt Nalett, who operates the volunteer-run Chicago Stolen Car Directory on Facebook, told WTTW-TV in August. “And kids are like, ‘We got nothing to do, let’s steal cars.’ When they were out that two years of COVID, they were bored and had nothing to do and stealing cars left and right.”",30,4
CyjTKnBSsmb,2023-10-18 19:16:14,GraphImage,"Republicans at 54% sided with Israel’s position more than Democrats at 37%.⁠
⁠",56,9
CyjE3BDM_RS,2023-10-18 17:14:03,GraphVideo,President Biden said Wednesday that U.S. intelligence corroborates Israel‘s claim that it was not to blame for the deadly explosion at a Gaza hospital that killed 500 people and sparked mass protests in Arab nations.,129,34
Cyi9FdDSUC6,2023-10-18 16:03:17,GraphImage,Republican lawmakers are demanding assurances that Homeland Security Secretary Alejandro Mayorkas won’t attempt a repeat of the Afghanistan airlift fiasco with Palestinians seeking to flee the war between Israel and Hamas.,142,20
Cyi1iTzMiZE,2023-10-18 15:00:46,GraphVideo,"On Wednesday's #FrontPage: Republicans tried, but failed, to elect a new speaker of the House, leaving the chamber on the verge of a third week in limbo, Israel has ramped up airstrikes against Hamas targets in Gaza, and more.",29,2
Cyitv08A4r6,2023-10-18 13:49:13,GraphImage,"Mr. Biden’s remarks back Israel‘s claim that it wasn’t responsible for the attack, but also underscores how quickly the situation is evolving. In a statement on the attack Tuesday, Mr. Biden said his national security team would “continue gathering information about exactly what happened.”",118,19
CyilzS-NyeJ,2023-10-18 12:40:43,GraphVideo,"#TopoftheTimes: Pentagon schools outperform public schools.

Tune in as The Washington Times' Tim Constantine discusses today's top stories",39,1
CyhTOYAIa0u,2023-10-18 00:38:15,GraphImage,"The Emerson College Polling Survey shows a race in which Mr. Biden generally holds an edge over Mr. Trump, the clear Republican front-runner. Yet the numbers are much tighter than Democrats would like as the ex-president battles a series of civil and criminal cases.",167,88
CyhLGP-tN3p,2023-10-17 23:27:17,GraphImage,"“We’re the United States of America, for God’s sake. The most powerful nation in the history of the world. We can take care of both of these and still maintain our overall international defense,” Mr. Biden said.",105,55
Cygz3PqMvXH,2023-10-17 20:04:11,GraphImage,"With a humanitarian crisis growing in Gaza and escalation concerns mounting, the Biden administration scrambled through the weekend to try to calm regional nerves while attempting to deter Iran and Hezbollah from further provocations.",101,32
CygsVJHyCkJ,2023-10-17 19:01:07,GraphVideo,"If this White House weren't so weak, then Hamas terrorists wouldn't have risen up when they did, breached Israel's boundaries, and abducted and murdered hundreds. But when the president of the United States can't barely stand and walk by himself, the evil forces of the world take notice and plot ways to exploit the situation. ⁠
⁠
Lt. Col, Tony Shaffer, retired, talks about the many, many problems from this administration that have contributed to the rise of terror and the world of chaos that now confronts us all.",120,18
CygkLmWs5NZ,2023-10-17 17:47:13,GraphImage,"“Hamas is winning the YouTube war,” said Michael Doran, senior fellow and director of the Center for Peace and Security in the Middle East at the Hudson Institute. “The spectacle of civilian casualties in Gaza — it’s having a much bigger effect in the Muslim world than the atrocities Hamas perpetrated” in its attack on Israel.",145,34
CygcZgrMKL1,2023-10-17 16:39:11,GraphImage,"President Biden strode into office promising to restore competency and credibility to U.S. foreign policy after four years of President Trump’s shoot-from-the-hip diplomacy, but several international missteps and crises abroad have undermined his claim.⁠
⁠",276,32
CygUdsLt95c,2023-10-17 15:31:08,GraphVideo,"On Tuesday's Front Page: Ohio Rep. Jim Jordan is still working to persuade Republican holdouts to vote for him for speaker, the FBI says murders, rapes and assaults dropped nationally over the past year, and more.",24,0
CygM8_OM_A9,2023-10-17 14:24:10,GraphImage,"House investigators Monday sought access to the trove of classified documents improperly taken and stored by President Biden, to determine if the sensitive material was used in connection with the Biden family’s lucrative foreign business deals.⁠
⁠",171,20
CygFQhOtK34,2023-10-17 13:18:12,GraphVideo,"#TopoftheTimes: Labor Department sitting on a $5 billion of leftover taxpayer money.

Tune in as The Washington Times' Tim Constantine discusses today's top stories.",34,2
CyfALcYtORE,2023-10-17 03:13:22,GraphImage,"The Biden campaign on Monday joined Truth Social, the web platform launched by former President Donald Trump in hopes of converting supporters of the former commander-in-chief into Biden voters.",112,21
Cye4RD7qXza,2023-10-17 02:04:12,GraphImage,"The Biden administration has reached a settlement with migrant parents whose children were separated under President Trump’s zero-tolerance border policy, promising them housing, medical care, trauma therapy, work permits and legal assistance to help them win a permanent place in the U.S.",124,57
CyewtleM89I,2023-10-17 00:58:11,GraphImage,"Former President Donald Trump is sketching out a second-term agenda on the campaign trail that includes reversing President Biden’s policies, finishing business from his first term and pursuing some outside-the-box ventures such as establishing “freedom cities” across the U.S.",218,31
CyepJ-HMwpg,2023-10-16 23:52:09,GraphImage,"For unionized carworkers, the plant is a potential threat to their job security. Many auto employees represented by the United Auto Workers work in factories building transmissions and gasoline-powered engines, things that are obsolete in a fully electric auto industry.",36,6
Cyeh8kAMImi,2023-10-16 22:49:09,GraphImage,"The report based its estimates on a sampling of national health surveys, including ambulance data. It offers the most recent government data on the “characteristics and differences” of assault victims who rely on emergency services, said Danielle Davis, a CDC health statistician and the report’s co-author.",38,8
CyeZt0RLiPb,2023-10-16 21:37:15,GraphImage,"The law requires an annual cost-of-living adjustment for benefits, based on rising prices. This year’s 3.2% COLA is lower than that of the last two years, when runaway inflation sent costs soaring.",43,4
CyeSjjXstAI,2023-10-16 20:34:44,GraphVideo,"""So we get the speaker, we get the house open and we get to work on the resolution and supplemental for Israel and we get back to work for the American people. That's what I'm committed to doing. And I think it's going to happen tomorrow,"" said Representative Jordan.",80,8
CyeKYLwujvk,2023-10-16 19:23:12,GraphImage,"Florida Gov. Ron DeSantis met 270 US. citizens fleeing the Israel-Hamas war at Tampa International Airport Sunday night.⁠
⁠
The flight was coordinated by Project Dynamo, a Tampa-based nonprofit made up of U.S. military veterans who do international search and rescue missions. The mission was called Operation: PROMISED LAND, which got the Americans, including 91 children plus two dogs, back from Israel, according to the group’s post on X.",165,13
CyeCec0sHHA,2023-10-16 18:14:11,GraphImage,"The IRS dropped the numbers into a raging debate in Washington over how aggressive the IRS should be in sweating out more money from Americans.⁠
⁠
The Biden administration is pushing for an aggressive approach, saying the wealthy aren’t paying their share, while Republicans are resisting, warning that a supercharged IRS would oppress even law-abiding taxpayers.⁠",41,5
Cyd7PknMi0W,2023-10-16 17:10:57,GraphImage,"Former Utah Gov. Jon Huntsman and his family will no longer donate to the University of Pennsylvania, his alma mater, the latest blow to the Ivy League school from a donor and alumni revolt over antisemitism on campus.⁠
⁠
Mr. Huntsman said in a message to Penn President Liz Magill that the Huntsman Foundation “will close its checkbook on all future giving to Penn” after three generations of support from the family, citing the university’s silence in the face of “historic Hamas evil.”",458,36
CydzZjmMWCt,2023-10-16 16:05:08,GraphVideo,"On Monday's Front Page: The Iran-backed militant group Hezbollah launched at least five anti-tank guided missiles into northern Israel, Texas Gov. Greg Abbott is stepping up his migrant busing campaign, and more.",25,2
Cydr2DIs13t,2023-10-16 14:56:18,GraphSidecar,"More than a dozen House lawmakers, mostly Democrats, declined to endorse a resolution to condemn the “barbaric war” launched by Hamas terrorists against Israel.⁠
⁠
The absence of their names from the resolution does not necessarily mean they won’t vote for its passage, but it puts them in a small class of their own that is out of step with more than 400 of their colleagues.⁠
⁠",64,7
CydjXrKt3N3,2023-10-16 13:47:29,GraphVideo,"#Topofthetimes: Nikki Haley is building momentum.

Tune in as The Washington TImes' Tim Constantine discusses today's top stories.",41,5
CydfOvFsnCF,2023-10-16 13:06:11,GraphImage,"Fall into digital subscription savings!⁠
⁠
Follow 🔗 in the bio to subscribe and save.",29,1
CyXLQtXsl9X,2023-10-14 02:16:14,GraphImage,Today's Washington Times #huntertoon:,233,25
CyXCyPdogNV,2023-10-14 01:02:11,GraphImage,"Kari Lake, a close ally of former President Donald Trump, filed paperwork last week to run and will officially launch her campaign Tuesday evening at an event in Scottsdale. She met with several top Senate Republicans on Capitol Hill last week amid concerns that her history of stolen election claims and unsuccessful bid for governor will cost the GOP the battleground seat that could determine control of the chamber.",118,22
CyWvNras2rF,2023-10-13 22:11:12,GraphImage,"The Labor Department‘s pandemic-era “first week” unemployment benefit program has been shut down for two years, but the department is still hoarding nearly $5 billion in cash that never got spent.⁠
⁠
Now an inspector general says it’s time to return the money to the Treasury Department, warning that leaving that kind of money sitting in a government account makes it a “risk for waste, fraud and abuse.”",59,8
CyWlfe0BhBn,2023-10-13 20:46:15,GraphImage,"Children of military service members and civilian defense employees in schools run by the Pentagon led the nation in math and reading last year, improving even after COVID-19 disruptions.",74,7
CyWRJTvyf7C,2023-10-13 17:51:16,GraphVideo,"The media would have it believed that January 6 was a violent insurrection of MAGA supporters who wanted to tear down the halls of Congress, beat up the Democrats and socialists who pretend to be Democrats with sticks and and clubs and the butts of rifles, and viciously assault and attack and injure, even kill, any police officer who dared stand in their way.⁠
⁠
But that’s the lie.⁠
⁠
Check out Bold & Blunt using the link in our bio to learn more.",106,9
CyWHRmbtMGD,2023-10-13 16:22:10,GraphImage,"Facing bipartisan criticism at home, the Biden administration has reportedly put a new hold on some $6 billion in Iranian funds held in a Qatari bank account in the wake of the attack by Palestinian Hamas militants on Israel that has killed more than 1,200 Israelis and foreigners.⁠
⁠
Iran has been a longtime financial and military backer of Hamas, although the U.S. government has said it has seen no evidence yet Iran’s theocratic regime knew of or helped carry out the gruesome weekend attack.",54,1
CyV-Bq2tNio,2023-10-13 15:04:30,GraphVideo,"On Friday's Front Page: House Majority Leader Steve Scalise surprised rank-and-file Republicans by dropping out of the speaker's race, Israel’s military has ramped up its promised campaign of retaliation against Hamas, and more.",45,7
CyV0jf_Mp3H,2023-10-13 13:38:34,GraphImage,"“Jewish people continue to face repeated violence and very real threats to your institutions and your houses of worship and to the individuals in your community simply for being who you are,” Mr. Wray told the more than 4,200 Jewish community leaders tuned in to the online event.",128,21
CyUbA-IsQYZ,2023-10-13 00:36:11,GraphImage,"A former leader of Hamas called on global Muslims to join the fight against Israel and stage protests in support of the Palestinian cause five days after terrorists stormed the barricade around Gaza and slaughtered more than 1,000 Israeli civilians.",77,31
CyUTOvxNgdX,2023-10-12 23:28:17,GraphImage,"Fall into digital subscription savings! ⁠
⁠
Follow 🔗 in our bio to save on your digital subscription.",36,0
CyULkXTp1ev,2023-10-12 22:24:02,GraphVideo,"""We're obviously doing everything we can to support and inform the families. Now, sadly, five more families have now gotten the worst possible news that any family can conceive of getting,"" said NSC spokesperson John Kirby.",147,34
CyUD5RZsX5w,2023-10-12 21:14:09,GraphImage,"CBO said the deficit was $1.69 trillion for the 12 months that began Oct. 1, 2022 and ended Sept. 30.⁠
⁠
And it would have been even worse — at $2 trillion — but for the Supreme Court’s ruling in June invalidating Mr. Biden’s massive student loan forgiveness plan. CBO said the government ended up crediting more than $300 billion in savings because of money it can no longer spend on Mr. Biden’s vision.",42,5
CyT8dWYRdGs,2023-10-12 20:09:11,GraphImage,"Mr. McCarthy, who acted as speaker for less than nine months, was removed from the position last week in a 216-210 vote. Only eight Republicans joined with House Democrats to vote him out.",40,4
CyTzyBuOXeD,2023-10-12 18:56:05,GraphVideo,"Hamas terrorists have wreaked havoc on Israel and others with similar anti-Semitic views are now seeking to do the same. ⁠
⁠
Alex Traiman, CEO of Jewish News Syndicate and Jerusalem bureau chief, gives a first-hand account of what he’s seeing and hearing on the ground in Israel, and offers analysis on where it’s all heading.⁠
⁠
Watch this special episode of #boldandblunt using the link in our bio.",56,8
CyTsGZ6M2wY,2023-10-12 17:46:13,GraphImage,"“It’s not a war or a battlefield; it’s a massacre,” Israel Defense Forces Maj. Gen. Itai Veruv told the country’s i24NEWS channel. “You see the babies, the mother, the father, in their bedrooms, in their protection rooms, and how the terrorists killed them.”",45,2
CyTkT75sgTQ,2023-10-12 16:38:09,GraphImage,"A group of conservative holdouts dashed Republicans’ plans to elect a House speaker on Wednesday, leaving the chamber paralyzed for a second week as lawmakers struggled to unite their conference behind a candidate.",48,8
CyTcpgvsIeA,2023-10-12 15:34:21,GraphVideo,"On Thursday's Front Page: A group of conservative holdouts have dashed Republicans’ plans to elect a House speaker, Israeli leaders have announced a historic wartime government and ramped up a massive counterattack against Hamas, and more.",44,3
CyTU-rctGGd,2023-10-12 14:24:18,GraphImage,"The worst fighting in Israel in a quarter century has many worried that the clash with Hamas could spiral far beyond Gaza and trigger a war that draws in regional and even global powers, including the U.S., China and Russia.",135,16
CyTNmXbtJV6,2023-10-12 13:20:35,GraphVideo,"#TopoftheTimes: Auto companies are laying off workers in response to the strikes.

Tune in as The Washington Times' Tim Constantine discusses today's top stories.",38,0
CyR944pN1yQ,2023-10-12 01:43:14,GraphImage,Today's Washington Times #huntertoon:,202,92
CyR2OCGoJ6m,2023-10-12 00:36:13,GraphImage,"“Joe Biden is trying to change the news cycle while Hamas terrorists commit atrocities in Israel, 22 Americans are dead, families of those kidnapped are pleading for help, and Iran is pocketing $6 billion in US tax dollars. Biden’s policies are junk and Americans are ready to take out the trash.” said RNC Spokesperson Anna Kelly.",132,22
CyRucKionTZ,2023-10-11 23:28:14,GraphImage,"Using Homeland Security’s data, the House Judiciary committee delivered the most comprehensive look to date at the border chaos. The report examines who has crossed illegally, how many have been released and how the administration has struggled to deal with the migrants once they are in the U.S.",52,9
CyRmyUJNDqn,2023-10-11 22:24:02,GraphVideo,"""While saying this, I want to also just speak about the responsibility that the U.S. administration, President Biden, and the Secretary of State (Antony) Blinken has for the lives of every U.S. citizen that is out there and they're responsible to bring the U.S. citizens back home safe and sound.”",135,8
CyRfGa2AFLw,2023-10-11 21:14:12,GraphImage,"Israel is calling up 300,000 army reservists as it prepares to escalate a conflict now focused on a densely packed area just over twice the size of the District of Columbia with a population of more than 2 million. Israel boasts one of the world’s most effective fighting forces, but the nature of the coming fight could nullify many of its advantages.",41,3
CyRXqUbMVhY,2023-10-11 20:09:10,GraphImage,"Hamas’ sneak attack into Israel across a heavily fortified border has focused new attention on American borders, where Republicans say the next 9/11-style attackers may be planning to enter — or already have.⁠
⁠
Lawmakers demanded that President Biden acknowledge the risks to the U.S. and respond with more border walls, troop deployments and an end to the catch-and-release free-for-all that has allowed millions of unauthorized migrants to disperse to communities across the country.",110,7
CyRO-QoP1vr,2023-10-11 18:56:04,GraphVideo,"New episode of #BoldandBlunt: There's not a person alive who doesn't have some sort of struggle in life. So the question is: How to overcome? ⁠
⁠
Guest Rob Carson is a syndicated radio talk show host, television presence and comedy writer, but he was once an alcoholic and unhappy car salesman who learned he was the child of rape. To say he suffered some dark moments in life is an understatement.⁠
⁠
He has much to offer about overcoming adversity, staying the course, turning to God for help and rising above the circumstances of life to realize the dream.",57,5
CyRHTZ0MgNj,2023-10-11 17:46:14,GraphImage,"Black Lives Matter Chicago apparently doesn’t think Israeli lives matter.⁠
⁠
The BLM chapter tweeted an image of a paraglider with a Palestinian flag and the caption “I Stand With Palestine,” a presumed reference to the deadly attack Saturday by Hamas on concertgoers near Kibbutz Re’im in Israel.⁠
⁠
The outcry was immediate. “Black Lives Matter Defends Hamas, Salutes Killer Paragliders,” said conservative podcast host Todd Starnes in a Wednesday post on X.",208,28
CyQ_hO0Ssii,2023-10-11 16:38:11,GraphImage,The majority of GOP voters say the Republican-controlled House should choose a speaker who is loyal to former President Donald Trump and supports the impeachment inquiry into President Biden.,78,6
CyQ325Mtqbv,2023-10-11 15:34:06,GraphVideo,"On Wednesday's Front Page: President Biden has denounced the “unadulterated evil” of Hamas’ terrorist attacks on Israel, the first General Assembly election under new state legislative maps in Virginia is fast approaching, and more.",47,2
CyQwLjZNAXZ,2023-10-11 14:24:16,GraphImage,"The blaring of sirens Saturday “didn’t seem scary” at first to Abbey Onn, but the Virginia native, who has lived in Israel with her family for the past eight years and has grown accustomed to the sound, soon discovered in the most gut-wrenching way that the nation was under a terrorist attack and her family was trapped in the crossfire.",137,11
