owner_username,url_code,time_utc,type,caption,likes,comments
NYTimes,Cze-kcpM9Cx,2023-11-11 00:00:35,GraphImage,"Barry Manilow is finally getting his wish: a Broadway show.

The musical, “Harmony,” tells the story of the Comedian Harmonists, a singing group torn apart by the rise of Nazism and World War II. It is a decades-in-the-making labor of love for Manilow and his longtime collaborator Bruce Sussman, who first conceived of the show in the early 1990s. 

“Harmony” debuted in San Diego in 1997 to mixed reviews, and failed to transfer. A planned Broadway run evaporated when financial backing disintegrated. Many iterations of the musical followed, but Broadway deals fell apart. “It was so heartbreaking every time it didn’t make it,” Manilow, the singer, said in an interview. Now, the musical will at last have its moment on the Great White Way. 

Tap the link in our bio to read about the many iterations of “Harmony” and how it finally made it to Broadway. Photo by @evelynfreja",14402,212
NYTimes,Cze0T98O7zo,2023-11-10 22:01:45,GraphVideo,"If you feel as though your pain is being ignored before, during or after a procedure, what do you do? Here are some tips on ways to advocate for yourself when speaking with a doctor.

Video by @caron_nyt , @claire_sandwich, @rurukuooo, Rebecca Suner",4132,119
NYTimes,CzembxtNNEF,2023-11-10 20:00:48,GraphSidecar,"Burned out from life in New York, the photographer @irjaliinapaavonpera traveled to northern Chile to study the ancient wisdom of the Lickanantay, the area’s Indigenous people. Here’s what she saw.

Tap the link in our bio to read about her experience and see more photos.",34434,256
NYTimes,Czec54UuvUL,2023-11-10 18:37:40,GraphVideo,"The Signs Were All There. Why Did No One Stop the Maine Shooter?

The shooter who killed 18 people with an assault-style rifle in Lewiston, Maine, displayed a textbook set of warning signs: He was hearing voices. He told people that he was planning violence. And his behavior had markedly changed in the months leading up to the mass shooting he carried out last month.

His family, his superiors in the military and the local police knew all of this. Yet no one stopped him.

Read more at the link in our bio. Video by Shaila Dewan and Claire Hogan",11784,720
NYTimes,CzeD3lxOEnL,2023-11-10 14:57:35,GraphSidecar,"Let’s take a moment to give a shout-out to Hoboken. As climate change delivers more extreme weather and rising seas, communities across the U.S. are struggling to prepare. That’s not Hoboken’s situation. New York City has been spending billions on flood walls and breakwaters and is still contemplating giant gates to hold back rising tides, but it hasn’t done as much to deal with rain. Hoboken has been adding infrastructure to cope with both rain and sea-level rise.

Hoboken’s goal is to collect and slow storm water. The city’s strategy has been to rebuild its sewers, adding capacity. The plan also bundles new infrastructure initiatives, which some see as invasive and time-consuming, with benefits residents desire, like new parks and playgrounds that have cisterns and basins. Streets redesigned to minimize traffic accidents also collect and redirect water: The redesign was a big reason the city bounced back so swiftly that rainy Friday in September, which dumped more than 3.5 inches of rain.

@michael_kimmelman, The Times’s architecture critic, took a close look at the strategies Hoboken is  adopting to grapple with water from both air and sea. Photos by @arnold_daniel",48564,382
NYTimes,Czd2kOaOi5q,2023-11-10 13:01:21,GraphSidecar,"After a long career as America’s most famous and least likely sex counselor, Dr. Ruth Westheimer has turned her attention to the epidemic of loneliness in the U.S. Last year, she set out to become the Loneliness Ambassador for New York State.

Loneliness has been on the rise since before the pandemic but escalated because of lockdowns and social distancing requirements. In May, the U.S. surgeon general issued an advisory that isolation can be just as deadly as smoking up to 15 cigarettes a day and can pose a greater risk to longevity than being sedentary or obese. 

But when Dr. Westheimer began her quest for the job, no such position existed. Tap the link in our bio to learn how she got it. Photos by @gabbyjones.jpeg",39553,372
NYTimes,CzcjbHYLmzv,2023-11-10 00:54:51,GraphSidecar,"At times, Washington, D.C. can feel like a tale of two cities: politicians and temporary dwellers versus multigenerational residents fighting to hold on to their piece of the district.
 
Once known as “Chocolate City” because of its predominantly African American population, Washington has seen its demographics shift dramatically in recent decades, bringing both positive and negative effects of gentrification. The second phase of the Wharf district, a $3.6 billion development, has contributed a new Pendry luxury hotel and splashy dining destinations, all set against the backdrop of skyrocketing living costs (only recently cooling), increased crime and ongoing questions of cultural identity. But even in this time of transition, Washington is still a hub of art, history and social justice leadership, and is home to many of the best free museums and monuments in the world.

Ready to spend a weekend in the nation’s capital? We have your itinerary ready to go. Tap the link in our bio to see what else we have planned. Photos by @julia.nikhinson",26799,268
NYTimes,CzcYJcjP3QC,2023-11-09 23:17:25,GraphVideo,"New York City is legally obligated to provide a bed for every homeless person who asks for one, under a decades-old court settlement. But 18 months into a migrant crisis that shows no signs of abating, it has walked away from its obligation, at least for some people.

The city, which is currently providing emergency shelter to more than 65,000 migrants, is no longer guaranteeing beds for single adults who have hit the city’s 30-day or 60-day limit on stays at any one migrant shelter.

Read the full story at the link in our bio. Video by @andylocal2, @rebeccasuner, @globalgabrielgrey",13301,1208
NYTimes,CzcOFL3Plkw,2023-11-09 21:49:04,GraphImage,"Senator Joe Manchin, the conservative West Virginia Democrat known for bipartisan deal-making and often being a thorn in the side of his party, announced on Thursday that he would not seek re-election, dealing a blow to Democrats’ chances of holding the Senate next year.

Instead, Manchin, who was likely to face a strong Republican challenger to keep his Senate seat in a deeply red state, suggested he would continue exploring whether there was an appetite in the country for a centrist third-party bid for the presidency. That prospect has alarmed many Democrats, who fear such a run could doom President Biden’s hopes of remaining in the White House.

This is a developing story. Tap the link in our bio to read the full story. Photo by @kenny_holston",12895,873
NYTimes,Czb158aO3x6,2023-11-09 18:17:06,GraphSidecar,"At the third Republican primary debate on Wednesday, five Republican presidential candidates delivered pointed criticism of one another — in addition to President Biden and Donald Trump — in an effort to stand out to voters as the first nominating contests draw near.

The rivals, all running well behind  Trump — who once again declined to participate — made the case for their candidacies on issues including foreign policy, abortion and the economy, often talking over one another as they tried to promote themselves and take one another down. In the process, they employed facts that were occasionally true, sometimes misleading and occasionally downright false.

Here is a fact-check of some of their statements. Read more fact-checks of the GOP debate at the link in our bio.",38680,1859
NYTimes,CzboSD9uJAL,2023-11-09 16:18:03,GraphImage,"Tracy Chapman became the first Black songwriter to win song of the year at the Country Music Awards for “Fast Car,” a folk ballad that topped the country charts more than three decades after it was first released, thanks in part to a cover by the singer Luke Combs.

Chapman did not attend the awards ceremony on Wednesday in Nashville but thanked the crowd in a statement that was read on stage by Sarah Evans, a co-presenter of the award.

“It’s truly an honor for my song to be newly recognized after 35 years of its debut,” Chapman’s statement said. “Thank you to the CMAs and a special thanks to Luke and all of the fans of ‘Fast Car.’”

Tap the link in our bio to read more about the award. Photo by Bryan Bedder/Getty Images",162316,1003
NYTimes,CzbgkOSMacD,2023-11-09 15:10:38,GraphSidecar,"With so much hinging on refilling the ranks, efforts are underway to draw more Ukrainian women into the army. Volunteer groups offering all-female training are supporting the effort.

About 43,000 women now serve in the Ukrainian military, according to the ministry of defense, an increase of about 40% since 2021, the year before Russia’s full-scale invasion. Ukrainian women are in combat in southeastern Ukraine now. After the invasion, the military abolished restrictions that kept women from roles such as machine gunner, tank commander and sniper, and lifted rules prohibiting women from driving trucks. It raised the age limit for female recruits, previously 40, to 60, the same as for men.

“The gender of a warrior makes no difference,” said Darya Trebukh, the founder of the nongovernmental group, Ukrainian Valkiriya, that is leading the training sessions.

Tap the link in our bio to read the full story. Photos by @hoffmanbrendan",61310,2224
NYTimes,CzbYXUAuUUP,2023-11-09 13:58:58,GraphSidecar,"“Thanksgiving is a major production if you’re the host, and generally I encourage cutting a few corners,” Claire Saffitz writes. “But I draw the line at dessert.”

“As a baker, I give my all to the pie spread, making my own crusts, assembling fillings from scratch and softly whipping fresh cream for serving. No matter the number of guests we’re expecting, I insist on preparing the pie trifecta (pie-fecta?) of apple, pumpkin and pecan, with some twists.” 

@csaffitz’s updated classics and brand-new favorites are ready for your Thanksgiving table: There’s a pecan slab pie, a cranberry cheesecake tart, a caramelized apple pie, a pumpkin pie with pepitas and a creamy lemon pie with honey and ginger. Make one or all five.

All the recipes, plus her method for a foolproof pie dough she spent years developing, are at the link in bio.

Photo: @armandorafaelphotography, food styling: @lpelican",14691,81
NYTimes,Czahn1EOq1j,2023-11-09 06:02:05,GraphVideo,"Third GOP Debate: Haley and DeSantis Take Leading Roles

The third Republican presidential debate on Wednesday devolved at times into brutal personal attacks as the five candidates onstage tried to discuss high-minded issues from the fate of Social Security to the role of America abroad between cutting asides and provocative insults.

The most heated exchange came over the unlikely issue of TikTok. After Vivek Ramaswamy bragged about using the Chinese-owned social media network to broadcast his message, he turned to his adversary, Nikki Haley, and mocked her daughter for using the app.

But the debate did address weighty issues: whether a soaring budget deficit required a higher retirement age for access to Social Security and Medicare, how the U.S. should back Israel against Hamas and Ukraine against Russia, and how a president could immediately address the strain of inflation in everyday life.

Tap the link in our bio to read more from Wednesday’s GOP debate.",8987,2412
NYTimes,CzaKZ34LoKg,2023-11-09 02:37:44,GraphImage,"One of the longest labor crises in Hollywood history is finally coming to an end.

SAG-AFTRA, the union representing tens of thousands of actors, reached a tentative deal for a new contract with entertainment companies on Wednesday, clearing the way for the $134 billion American movie and television business to swing back into motion.

Hollywood’s assembly lines have been at a near-standstill since May because of a pair of strikes by writers and actors, resulting in financial pain for studios and for many of the two million Americans — makeup artists, set builders, location scouts, chauffeurs, casting directors — who work in jobs directly or indirectly related to making TV shows and films.

Tap the link in our bio to read more about how the actors union and entertainment companies agreed to a deal.",15912,128
NYTimes,CzaFw8cRxv8,2023-11-09 01:57:12,GraphSidecar,"Five candidates kicked off the third Republican presidential debate in Miami on Wednesday, discussing abortion, foreign policy and the economy.

The changing landscape will most likely alter the strategic calculations of the candidates who qualified under the Republican National Committee rules: Nikki Haley, the former South Carolina governor; Ron DeSantis, the Florida governor; Chris Christie, the former New Jersey governor; Vivek Ramaswamy, an entrepreneur; and Tim Scott, the South Carolina senator. Former president Donald Trump did not participate in the debate.

Tap the link in our bio for live updates with reporters and editors from The New York Times. Photos by @scottymacphoto and @maansi.photo",11477,651
NYTimes,CzZtp7dvSPd,2023-11-08 22:32:23,GraphVideo,"Support for Israel to Take Center Stage at GOP Debate

Israel’s war in Gaza has become a major focus of the 2024 Republican presidential race. While the Republican Party is more unified in its support for Israel (in contrast with the Democratic Party), the conflict has prompted some of the field’s sharpest criticism of former President Donald Trump, who will not be attending for the third debate in a row.
New York Times political correspondent Lisa Lerer reports on how that’s likely to play out at the next debate.

Tap the link in our bio to read the five things to watch at the third GOP presidential debate. Video by Lisa Lerer, Mark Boyer and Kassie Bracken/The New York Times",3266,523
NYTimes,CzZnHgWOZJT,2023-11-08 21:29:24,GraphImage,"Shell email accounts, phantom truckers, supply-chain fraud and one seriously bewildered cargo freight broker. This is the long, strange story of one stolen load of valuable cargo in the form of 55,000 rare Kit Kats.

Sought-after Kit Kat flavors like melon, matcha latte and daifuku mochi are a booming business. In Japan, enthusiasts clamor for the rarer flavors, with some sold for just a few weeks or only in a specific region. In the United States, obsessives fawn over the collectibles, comparing reviews on Japanese snack blogs and shelling out for limited editions.

Danny Taing, the founder of a New York company that sells Japanese snacks in subscription boxes, had bought $110,000 worth of the sweets, expecting to make about $250,000 in total revenue. The shipment arrived Stateside from Japan, but somewhere along its cross-country journey, it went missing. What happened?

Tap the link in bio to read more from @amelia.nierenberg about how a load of rare Kit Kats became the object of an elaborate cargo theft, a growing area of crime in the U.S. 

Photo by @adamamengual",45351,754
NYTimes,CzZeDe-O4KD,2023-11-08 20:10:12,GraphSidecar,"A looming rematch next year between President Biden and former President Donald Trump has left voters deeply dissatisfied with their options, longing for alternatives and curious about independent candidates like Robert F. Kennedy Jr., according to new polls of six battleground states conducted by The New York Times and Siena College.

Both Biden and Trump are viewed unfavorably by a majority of voters in these states, one-fifth of voters don’t like either of them, and enthusiasm about the coming election is down sharply compared with a poll conducted before the 2020 contest.

Tap the link in our bio to read the full analysis.",12141,1189
NYTimes,CzZWXJCOzkT,2023-11-08 19:03:43,GraphVideo,"Ohio Vote Continues a Winning Streak for Abortion Rights

In Ohio, a ballot measure establishing a right to abortion in the State Constitution won in an election on Tuesday by a double-digit margin, a striking demonstration of support for abortion rights in a conservative state that Donald Trump won twice by convincing margins.

The results amounted to a resounding victory for abortion rights, proving once again that the issue can energize a broad coalition of Democrats, independents and even some moderate Republicans.

Tap the link in our bio to read more from the election.",52314,2628
NYTimes,CzZOUg_Ls-e,2023-11-08 18:00:07,GraphVideo,"The House of Representatives voted on Tuesday to censure Representative Rashida Tlaib, Democrat of Michigan and the sole Palestinian American in Congress, formally rebuking her for her statements regarding the Israel-Hamas war.

Twenty-two Democrats joined most Republicans to pass the resolution, which accuses Tlaib of “promoting false narratives” surrounding Hamas’s Oct. 7 attack on Israel and of “calling for the destruction of the state of Israel.” The vote was 234 to 188. Four Republicans voted against censuring Tlaib, while one Democrat and three Republicans voted “present,” declining to take a position.

After the gavel fell, Democratic lawmakers, mostly progressives, surrounded Tlaib on the House floor and embraced her.

Tap the link in our bio to read the full story.",45443,5352
NYTimes,CzZEAwKLoda,2023-11-08 16:22:38,GraphImage,"Yusef Salaam, who was one of five Black and Latino teenagers convicted in the 1989 rape of a jogger in Central Park and exonerated decades later, was elected on Tuesday night to represent Harlem in the New York City Council.

Salaam, who ran unopposed, had won a commanding victory in a contested Democratic primary in June, when he defeated two sitting members of the New York State Assembly. The Democratic incumbent who currently holds the Council seat, Kristin Richardson Jordan, dropped out of the race before the primary.

Salaam, 49, spoke frequently during his campaign about his conviction, exoneration and persecution by former President Donald Trump, who took out full-page ads in The New York Times and other papers calling for the reinstatement of the death penalty in response to the case of the Central Park jogger.

Tap the link in our bio to read more about Salaam and to see more election results. Photo by @saranaomiphoto",96851,737
NYTimes,CzY_o3_rWWr,2023-11-08 15:44:26,GraphImage,"Cherelle Parker, a longtime state and local elected official who promised Philadelphia residents that she would aggressively tackle the city’s crime woes, was elected mayor Tuesday, according to The Associated Press, making her the first woman voted into the city’s highest office.

Viewed as more moderate than the other candidates in the Democratic primary in May, Parker, 51, pledged to hire hundreds more police officers and bring back what she called “constitutional” stop-and-frisk tactics. With registered Democrats vastly outnumbering Republicans in the city — the nation’s sixth most populous, with 1.6 million residents — Parker’s primary win gave her a significant advantage over the Republican nominee, David Oh, a former colleague of hers on the City Council.

Parker, a lifelong Philadelphian, will be the city’s 100th mayor. Tap the link in our bio to read more about Parker and her historic win. Photo by @hanloveyoon",38834,274
NYTimes,CzY6uvzugPA,2023-11-08 15:01:32,GraphSidecar,"On Wednesday, the Smithsonian’s National Zoo in Washington, D.C., will say goodbye to a family of giant pandas. 

Mei Xiang and Tian Tian, and their 3-year-old cub, Xiao Qi Ji, are scheduled to be loaded into crates and driven in trucks to a FedEx Boeing 777 called the Panda Express. They will then be flown 19 hours from Dulles International Airport to China, where they will join about 150 other pandas in a lush nature preserve in the misty mountains of Sichuan Province.

Giant pandas have been a fixture in Washington since 1972, when China sent the U.S. two pandas after Patricia Nixon, the first lady, mentioned her fondness for pandas to China’s premier during the landmark visit she and Richard Nixon made to Beijing. But U.S.-China tensions have been rising for years, and now there is speculation that China is asking for the return of the pandas because of the diplomatic deep freeze. Now, only one zoo in the U.S. will have giant pandas, but they are expected to return to China next year. 

Tap the link in our bio to read more from @ewongworld about the giant panda legacy in the U.S. and to learn what’s in store for the three pandas making their journey home. Photos by @erinschaff",61863,418
NYTimes,CzXwRTnMZEQ,2023-11-08 04:10:54,GraphImage,"Andy Beshear, a Democrat, won a second term as Kentucky’s governor on Tuesday, according to The Associated Press. It was a noteworthy victory in a deeply conservative state and one that validated his pragmatic approach during a first term that has been buffeted by a series of natural disasters.

Beshear, 45, one of the most popular governors in the country, led in polls throughout the race. He defeated Daniel Cameron, the state’s attorney general, who is a protégé of Senator Mitch McConnell of Kentucky and who has been considered a rising star in Republican politics. 

Tap the link in our bio to read more about @andybeshearky and the bitterly contested governor’s race in Kentucky. Photo by @jonpcherry",59215,462
NYTimes,CzXmj8lMuG7,2023-11-08 02:46:04,GraphImage,"Ohio voters approved a ballot measure on Tuesday to enshrine a right to abortion in the State Constitution, according to The Associated Press. This continues a series of wins for abortion-rights groups that have appealed directly to the public as they try to recover from the U.S. Supreme Court’s overturning of Roe v. Wade.

Issue 1, as the ballot measure is known, had become a closely followed part of Tuesday’s off-year elections. Both parties are looking to gauge whether voter anger over the loss of the federal right to abortion might help Democrats in next year’s presidential and congressional races. National groups on both sides of the debate poured money into Ohio in recent weeks.

The “yes” vote in Ohio, a conservative-leaning state, is likely to help lift the hopes of abortion-rights groups that are pushing similar measures next year in red and purple states, such as Arizona, South Dakota, Missouri and Florida. Tap the link in our bio to read more about the Ohio vote.",114385,1359
NYTimes,CzXM99eMOZQ,2023-11-07 23:02:25,GraphImage,"Maybe it’s her grandkids, maybe it’s being 81, but Barbra Streisand is open to new stuff. Take sharing. Well, take sharing about herself.

“My Name Is Barbra,” her first memoir, is upon us. It’s 970 pages and billows with doubt, anger, ardor, hurt, pride, persuasion, glory and Yiddish. “I don’t know that any artist has done more sharing,” writes @wsslyy, a critic at large for The New York Times.

Streisand talked to The Times about her new memoir, exploring the movies and men of her life, and her determination to control her own art. “If you want to read about me in 20 years or 50 years, whatever it is — if there’s still a world — these are my words,” she said. “These are my thoughts.”

Tap the link in our bio to read the full interview with @barbrastreisand, in which she speaks candidly about what’s in her new book. Photo by @ryanpfluger",37297,487
NYTimes,CzXAiynMric,2023-11-07 21:15:50,GraphImage,"Kimberly Mata-Rubio, the mother of one of the 19 children killed in the mass shooting last year in Uvalde, Texas, is now running for mayor. 

Mata-Rubio, a former news reporter, would be the first woman and only the third Latino to lead the Hispanic majority city, one that has been bitterly divided in the aftermath of one of the nation’s deadliest mass shootings. 

As president of Lives Robbed, an organization made up of mothers and grandmothers of the Uvalde victims, Mata-Rubio has organized rallies, flown to Washington and sat through legislative hearings in Austin, the Texas capital. Still it did not feel like she was doing enough.

Tap the link in our bio to read why @nicrubio was motivated to run for mayor and what she plans to do if elected. Photo by @tamirhasacellphone",48259,391
NYTimes,CzW0XCDu5uv,2023-11-07 19:27:23,GraphSidecar,"A proposed marine sanctuary in California is facing challenges after a last-minute boundary change to accommodate a wind farm.

The Chumash Heritage National Marine Sanctuary, a 7,573-square-mile area that would include 156 miles of coastline along central California, would limit offshore oil drilling, acoustic underwater testing and other activities. The sanctuary would also provide funding for research and protection to numerous sites, both on and offshore, that are sacred to the Northern Chumash, a tribe that has inhabited California’s coastline for thousands of years.

But the National Oceanic and Atmospheric Administration has thrown a wrench into those plans. In an effort to allow for the development of an offshore wind energy project, NOAA has suggested shifting the sanctuary’s borders to remove a section of the coastline that includes Morro Bay and Morro Rock — or Lisamu’, a site sacred to the Chumash that the tribe has been planning to make the hub of the sanctuary.

Tap the link in our bio to read more about the challenges facing the first tribal-led effort in the U.S., which is also guided by Native history, culture and knowledge. Photos by @photographnic",32142,171
