owner_username,url_code,time_utc,type,caption,likes,comments
NYTimes,CzWrZbGLtfF,2023-11-07 18:09:04,GraphSidecar,"There are unwritten rules when riding the New York City subway.

No eye contact. No blocking doors. No hogging seats.

Three years after the coronavirus nearly wiped out ridership in the nation’s largest transportation network, millions of travelers are reacquainting themselves with transit’s informal customs. The pandemic had suspended these protocols as many passengers stayed home. But now, in a sign that normalcy might be returning, old subway tensions are creeping back as more riders pack into the system.

What are New Yorkers’ top rules for riding the subway? Tap the link in our bio to find out. Photos by @cherkis",85342,1904
NYTimes,CzWieD4LrDT,2023-11-07 17:19:35,GraphVideo,"Trapped in a territory under siege, Palestinians are documenting and sharing, on Instagram, their harrowing experiences of life under Israeli airstrikes and a ground invasion. One month into the war, @motaz_azaiza and @hindkhoudary have amassed huge followings for their raw and intimate videos. Their posts have led some Israeli media outlets to accuse them of being Hamas propagandists. And yet, Azaiza and Khoudary are living through the war they are covering: surviving intense bombardments, burying their colleagues, watching their homes crumble, and pulling their own families from the rubble.

Tap the link in our bio to read the full story. Video by @nik_olov_ and @yousuralhlou",380660,16607
NYTimes,CzWSu44ONIZ,2023-11-07 14:35:32,GraphImage,"For more than a century, Lessie Benningfield Randle, one of the last known survivors of the 1921 Tulsa race massacre, has lived with the searing details of that spring. For decades, she has recalled the fire that ravaged her neighborhood, Greenwood, and the frantic trip with her grandmother to the safety of a fairground.

Randle’s 109th birthday is Friday. She was 6 years old when a white mob attacked Greenwood with indiscriminate violence that wrought death and destruction and erased much of the promise of economic stability for future generations. She and the only other known survivor, Viola Fletcher, 109, are united in a historic legal battle to force the City of Tulsa and others to answer for the massacre.

“I would like to see justice. It’s past time. I would like to see this all cleared up and we go down the right road,” Randle said in an interview with The New York Times. “But I do not know if I will ever see that.”

On Monday, a team of lawyers representing Randle, Fletcher and the estate of Fletcher’s younger brother, took what they consider to be the last legal step in their long quest for justice. Tap the link in our bio to read Randle’s full story and to learn about the latest in her legal battle. Photo by @michaelnoblejr",193496,939
NYTimes,CzU4M8JR19H,2023-11-07 01:22:29,GraphImage,"LeVar Burton, who hosted the children’s TV show “Reading Rainbow,” is engaging young audiences again with “Sound Detectives,” a comic mystery podcast that teaches the art of listening.

Burton, who played Geordi La Forge on “Star Trek: The Next Generation” and Kunta Kinte in “Roots,” is best remembered by many parents for “Reading Rainbow.” In the podcast, Burton and his team try to solve a mystery about an errant sound, which they identify, and then interview real-life experts who discuss it.

Tap the link in our bio to read more about @levar.burton’s first podcast for children which, he stressed, he did not see as a long-awaited return to young people’s entertainment. “I don’t feel like I’ve ever left it,” he said. Photo by @arielfish",46553,418
NYTimes,CzUuiFbvyRo,2023-11-06 23:57:59,GraphImage,"Hundreds of protestors, led by the activist group Jewish Voice for Peace, rallied in front of the Statue of Liberty on Monday to call for a cease-fire in Gaza.

It was the latest in a series of protests, vigils and other events that Americans on opposing sides of the conflict between Israel and Hamas have organized almost daily in cities across the country since the beginning of the war. Over the weekend, thousands marched in demonstrations in cities including Cincinnati and Provo, Utah, as the death toll in Gaza continued to mount.

Tap the link in our bio to read more about the protesters at the Statue of Liberty. Photo by @dave_sanders",119154,3139
NYTimes,CzUqFAXP8DK,2023-11-06 23:20:16,GraphVideo,"In a rally outside Israel’s Parliament, hundreds demand more action on hostages.

Hundreds of people gathered around the Knesset, Israel’s Parliament, in Jerusalem on Monday to demand again that the Israeli government do more to bring hundreds of hostages home — repeating one word, over and over: “Now, now, now.”

It was the latest rally since 242 were kidnapped after Hamas stormed across the border in an attack that killed at least 1,400 people. The hostages include civilians and soldiers from more than 40 countries.

Tap the link in our bio to read more about the rally in Israel. Videos by @sergeyponomarev",10705,2543
NYTimes,CzUaX-aAD9c,2023-11-06 21:01:51,GraphSidecar,"When @rebeccayarros pitched her publisher a sexy fantasy about telepathic dragons and their riders, she thought it might be a tough sell. However, “Fourth Wing” — an intricately plotted 500-plus-page narrative that takes place at an elite war college as two dragon riders feud, then fall in love — became a huge best seller. And on Tuesday, after much anticipation, the novel’s follow-up, “Iron Flame,” the second installment of a planned five-book series, is scheduled to publish.

The runaway success of “Fourth Wing” stems in part from Yarros’s experience with chronic illness and her life in a military family, which she drew on while crafting the novel.
“Writing Violet is super cathartic, because she struggles to accept the accommodations that are given to her, and I have that same struggle,” Yarros said in an interview with The New York Times.

Tap the link in our bio to read the full profile of Yarros — and to learn about “Fourth Wing” and “Iron Flame.” Photo by @joanna_kulesza",37366,339
NYTimes,CzUSDAuORRJ,2023-11-06 19:49:05,GraphSidecar,"The Golden Gate Bridge, a rare blend of form and function, stands as an engineering marvel, an emblem of Depression-era American muscle. But it has a darker legacy, too: About 2,000 people are known to have died by jumping off the bridge. The true tally is certainly higher, since not all jumps are witnessed and not all bodies are found. 

Such tragedies, officials hope, are mostly in the past. After decades of pleas to raise the rail, workers are nearly finished installing 3.5 miles of stainless-steel nets — a “suicide deterrent system,” officials call it — strung on both sides of the bridge, end to end. The nets, which are nearly invisible from a distance, were chosen to appease those worried about altering the bridge’s iconic look or obstructing its famous views. But the nets can be seen by anyone standing at the rail, hanging about 20 feet down and stretching about 20 feet out. They are taut, marine-grade stainless steel nets meant to withstand the Golden Gate’s combination of rain, wind, salt and fog.

Tap the link in our bio to learn more about the long fight to make the bridge safer. Photos by @jimwilson125 

If you are having thoughts of suicide, call or text 988 to reach the 988 Suicide and Crisis Lifeline or go to SpeakingOfSuicide.com/resources for a list of additional resources.",223088,1744
NYTimes,CzUJdAaOjJf,2023-11-06 18:36:16,GraphVideo,"Voters in one county in Washington State have picked the winner in every presidential election from Reagan to Biden. What do they think now, a year from Election Day?

Tap the link in our bio to listen to this episode of “The Run-Up” podcast, your guide to the 2024 election, hosted by Astead Herndon.

Video by Astead Herndon, Karen Hanley, Dave Horn and Caitlin O’Keefe/The New York Times",9704,442
NYTimes,CzT-ZU1rlSL,2023-11-06 16:57:22,GraphSidecar,"For Donald Trump, a new set of New York Times/Siena College polls captures a stunning, seemingly contradictory picture.

His 91 felony charges in four different jurisdictions have not significantly hurt him among voters in battleground states. Yet he remains weaker than at least one of his Republican rivals, and if he’s convicted and sentenced in any of his cases, some voters appear ready to turn on him — to the point where he could lose the 2024 election.

Trump leads President Biden in five key battleground states — Arizona, Georgia, Michigan, Nevada and Pennsylvania, according to the Times/Siena polls. 

Read the full analysis at the link in our bio.",64000,9461
NYTimes,CzT2L7HJ4jV,2023-11-06 15:47:36,GraphImage,"Donald Trump’s trial will continue Monday in a New York courtroom with him on the witness stand, part of a proceeding that threatens the business empire that underpins his public persona and that fostered his run for the White House.

New York’s attorney general, Letitia James, called Trump to the witness stand at his own civil fraud trial in Manhattan, where, under oath and under fire, the former president will try to convince a single skeptical judge — not a jury — that he played no role in the inflation of his net worth to defraud banks and insurers.

Privately, Trump has told advisers that he is not concerned about his time on the stand. He held preparation sessions when he was in New York attending the trial, according to people briefed on the matter. Trump is deeply, personally enraged by this trial — and the fact that his children have had to testify, according to several people who have spoken with him — and he may not be able to restrain himself on the stand.

We’re covering the fraud trial live. Tap the link in our bio for the latest updates. Photo by Jefferson Siegel for The New York Times",33837,1739
NYTimes,CzTsPi2uBAo,2023-11-06 14:20:32,GraphSidecar,"Doctors and nurses in Gaza’s teetering hospitals, which are nearing collapse without electricity and basic supplies, say they must now decide which patients get ventilators, who gets resuscitated, or who gets any medical treatment at all. They make snap decisions amid the screams of small children undergoing amputations or brain surgeries without anesthesia or clean water to wash their wounds.

Some veterans of wartime medicine in the Gaza Strip say conditions inside the overcrowded and impoverished territory are the worst they have ever seen, as entire apartment blocks, schools and hospitals crumble under an Israeli bombardment that has left a devastating civilian toll.

Tap the link in our bio to read more about the crisis that doctors are facing in Gaza and to get the latest updates on the war. Photos by @samarabuelouf",66631,3865
NYTimes,CzSaXoHO3E0,2023-11-06 02:23:19,GraphImage,"In his new dark comedy, “Dream Scenario,” Nicolas Cage plays a man who begins popping up in people’s dreams. It’s a metaphor for viral fame that he found cathartic.

“For me, this movie is an interesting analysis about the experience of fame,” said Cage, who called “Dream Scenario” one of the five best scripts he’s ever read. (The others are “Leaving Las Vegas,” which won him the Oscar for best actor, “Raising Arizona,” “Vampire’s Kiss” and “Adaptation.”) 

“When you think of ‘Nic Cage,’ I wanted people to think you were going to see something just a little bit unpredictable, a little bit scary,” he said. “It’s not going to be the same old, same old.”

Read The New York Times’s full interview with Cage at the link in our bio. Photo by @devinyalkin",35922,284
NYTimes,CzSK8kqubMv,2023-11-06 00:09:11,GraphVideo,"Israeli Airstrike Hits Residential Area, Gazan Authorities Say

An explosion in Al Maghazi, a densely populated part of the central Gaza Strip, was caused by an Israeli airstrike, the Gazan health ministry said. Video taken in the aftermath shows people searching through the rubble for victims.

Read more about what we know at the link in our bio.",19503,3411
NYTimes,CzR8QBYuN-G,2023-11-05 22:00:35,GraphVideo,"2023 New York City Marathon

New Yorkers turned out in droves to cheer on thousands of runners in the New York City Marathon. Tamirat Tola, the winner in the men’s elite field, broke the course record; Hellen Obiri earned a dramatic victory in the women’s elite field; and Catherine Debrunner and Marcel Hug set records in the wheelchair divisions.

Video by @amirbangs, @benjaminnorman, @hiroko.masuike, @wattsanna_, @adriennegrunwald, @rosemmorton, @claire_sandwich",44708,345
NYTimes,CzRx7u6RDur,2023-11-05 20:29:59,GraphImage,We asked sex therapists and researchers which myths they wished would go away. Read the eight they talked about — and how they debunked them — at the link in our bio.,46289,432
NYTimes,CzRnUbWuDiI,2023-11-05 18:57:14,GraphSidecar,"Some 50,000 athletes are competing in the New York City Marathon under clear skies and unseasonably warm temperatures, and many more people have lined the race course across all five boroughs to cheer them on.

Marathon Day is something of an unofficial holiday for New York City, as people come out with costumes, cowbells, live music and pun-filled signs to support the runners.

Last year, 47,839 marathoners from 131 countries finished the race. Their average time across the finish line in Central Park was 4 hours 50 minutes 26 seconds.

You can read our earlier coverage of the marathon at the link in our bio. Photos by @rosemmorton, @karstenmoran, Earl Wilson/The New York Times, @hiroko.masuike, @wattsanna_, @adriennegrunwald and @maansi.photo",85653,247
NYTimes,CzRYtd9Ow5o,2023-11-05 16:49:35,GraphSidecar,"Tamirat Tola of Ethiopia set a course record in his first New York City Marathon, while Hellen Obiri of Kenya broke away from a pack of elite women at the end of the race for a dramatic victory. Obiri finished in an unofficial time of 2:27:23. Tola finished in an unofficial time of 2:04:59.

Switzerland dominated the wheelchair races. Catherine Debrunner easily won her first New York marathon in a time of 1:39:32, a course record. And Marcel Hug, also of Switzerland, won his third straight men’s race in an unofficial time of 1:25:28. It’s his sixth overall New York victory, a new record, surpassing the five wins of Kurt Fearnley.

Read more of our New York City Marathon coverage at the link in our bio. Photos by Uli Seit for The New York Times.",65636,194
NYTimes,CzRHFi1u8sS,2023-11-05 14:16:46,GraphVideo,"How U.S. Troops Were Harmed By Firing Their Own Guns

A secret U.S. offensive in 2016 and 2017 used an unusual strategy to fight the Islamic State. The plan: Put a minimal number of American troops on the ground and have them pound the enemy with relentless artillery fire. What no one foresaw was the devastating toll it would take on the troops who did the firing.

Research has started to reveal that as with hits in football, repeated blast exposure from firing heavy weapons may cause irreparable injury to the brain. It is a sprawling problem that the military is just starting to come to grips with.

Dave Philipps of The New York Times spoke to dozens of veterans experiencing mysterious, life-shattering mental and physical problems and investigated a type of brain injury that may have caused the problems.

Video by Dave Philipps, @boatcloak, Rebecca Suner, Ruru Kuo",32139,1533
NYTimes,CzPsScKO3cw,2023-11-05 01:03:33,GraphVideo,"Blinken Says Cease-Fire in Gaza Would Allow Hamas to Regroup

Antony Blinken, the U.S. secretary of state, rebuffed calls from his counterparts in Egypt and Jordan for an immediate cease-fire in Gaza, saying that a halt would allow Hamas to repeat its attack on Israel.

Read more of our live updates on the Israel-Hamas War at the link in our bio.",33379,9403
NYTimes,CzPiEvqOK4C,2023-11-04 23:32:55,GraphSidecar,"Thousands of demonstrators filled the streets of Washington and other cities across America on Saturday to protest the scope and scale of Israel’s retaliation in Gaza for last month’s terrorist assault by Hamas.

Saturday’s marches, organized in cities including New York, Nashville, Cincinnati, Las Vegas and San Francisco, extended a stretch of calls for a cease-fire and a lifting of the siege, following widespread demonstrations a week ago in Asian and European capitals.

Read more about the protests and follow our live coverage of the Israel-Hamas War at the link in our bio. Photos by @amirbangs in Washington, @rachelbujalski in San Francisco and @kimraffphoto in Provo, Utah.",164583,7048
NYTimes,CzPOknEuBbE,2023-11-04 20:42:31,GraphSidecar,"New mothers will be starting the New York City Marathon with something helpful speckled along the course: lactation stations.

In addition to lactation tents, there will be a service that allows runners to transport personal nursing pumps from the start area in Staten Island to the finish area in Central Park. Inside the tents, runners will have access to private spaces and hand pumps.

Read more about new moms running marathons and how the New York City Marathon is offering them support at the link in our bio. Photos by @rosemmorton",58958,481
NYTimes,CzO6KWRxaXn,2023-11-04 17:44:10,GraphImage,"Severe obesity is the fastest-rising subcategory among youth — “an epidemic within an epidemic,” as the American Academy of Pediatrics calls it.

Pictured here is 16-year-old Alexandra Duerte, who has been living with polycystic ovary syndrome and prediabetes since she was 10. Her doctor suggested bariatric surgery, an operation on the gastrointestinal tract that helps patients lose weight. Alexandra is one of the roughly 20% of children in the U.S. are living with obesity. Some can develop what were once considered adult illnesses: hypertension, diabetes, fatty liver disease. Obesity can also magnify mental-health problems.

How far should doctors go to treat obesity? Read the story at the link in our bio. Photograph by @kholoodeid.",12862,585
NYTimes,CzOvn74OqcZ,2023-11-04 16:12:05,GraphSidecar,"More than 500 runners with disabilities and guides are participating in this year's New York City Marathon. Francesco Magisano is one of them: Sunday will mark the sixth time the 28-year-old, who lost his vision as a teenager, will run the race. 

But long before marathon day, Magisano started breaking in the new guide who will accompany him on the course: Nev Schulman, the producer and host of MTV’s ""Catfish"" reality TV show,  has run the marathon six times before, but never as a guide. The two men only recently started training together with Achilles, a group of runners with disabilities who met twice a week for runs in Central Park.They run be connected by a running tether that helps them navigate the course together. 

For Schulman, the inspiration to be a guide came during an encounter with an blind runner during a previous marathon. “I hear from behind: ‘Blind runner! Blind runner on your right!’ and two guides guiding what I guess was a 50-something-year-old woman and they just really flew past me,” Schulman said.

Tap the link in our bio to read about how Magisano and Schulman are preparing for the race, where organizers expect 50,000 finishers on Sunday. Photos by @wattsanna_",49564,278
NYTimes,CzOmgnMucBH,2023-11-04 14:52:26,GraphSidecar,"On Oct. 7, Hamas terrorists staged a surprise attack on Israel, killing roughly 1,400 people in their homes, at a music festival and on the streets. 

For most, the threat dawned immediately. Israelis retreated to safe rooms, monitoring pleas for help they could not answer on WhatsApp, or worrying for hours with no news of loved ones. The events still haunt those who survived. 

Tap the link in our bio to read their stories. Photos by @avishag_sy",83856,16056
NYTimes,CzOZm57Ojwq,2023-11-04 12:59:42,GraphImage,"""I think this knocked out my head cold,"" wrote one commenter. Whether you're sick or just in need of something cozy, @alexaweibel's Chicken and Rice Soup With Ginger and Turmeric is at the link in bio. Photo by @johnny_miller_, with food styling by @rebeccajurkevich",62544,327
NYTimes,CzNA_o1vx14,2023-11-04 00:05:23,GraphImage,"Peso Pluma, Mexico’s breakout music star, is bringing an updated version of traditional music to international audiences.

Peso, whose real name is Hassan Emilio Kabande Laija, is the reigning king of corridos tumbados, a modern version of traditional Mexican music, which has found great success over the last couple of years. More than a dozen weeks after the release of Peso’s third album, “Génesis,” it remains in the top 10 on Billboard’s all-genre album chart. On Spotify, his songs have been streamed several billion times.

Tap the link in our bio to read more about @pesopluma and find out which hip-hop artists are currently inspiring him. Photo by @josefinasantos",49705,1105
NYTimes,CzM36hGPDpO,2023-11-03 22:46:03,GraphSidecar,"On Friday, President Biden met with the families of those killed or injured during the rampage last month that claimed the lives of 18 people at a bar and a bowling alley in Lewiston, Maine.

He also met with nurses, local officials and the law enforcement officers who spent two days in a manhunt for the killer. “Jill and I are here on behalf of the American people to grieve with you, and make sure you know that you’re not alone,” Biden said after stopping by a makeshift memorial in Lewiston with his wife, Jill Biden. The president used the opportunity to urge Americans to seek consensus more broadly in the hopes of avoiding more of the spasms of deadly violence that have become a routine part of life in the U.S.

Tap the link in our bio to read more about Biden’s visit to Maine. Photos by @haiyunjiang",39112,2249
NYTimes,CzMtsxsyUtw,2023-11-03 21:16:47,GraphSidecar,"The Battle of the Bridge is the biggest football game of the year in Lewiston and Auburn, cities separated by a river in Maine. This season’s matchup came almost exactly a week after a gunman began a shooting spree that killed 18 people and wounded 13 others. 

The game, originally scheduled for last week but played on Wednesday, was a return to routine for the cities after the state’s deadliest mass shooting. It was a chance to celebrate in the open after days of sheltering in place during a terrifying manhunt.

“Long after this game is over, no one is going to remember the score,” said Jason Versey, the Lewiston football coach. “People are going to remember that we came together.”

Tap the link in our bio to read more about the game and how the Lewiston community has come together following the tragedy. Photos by @acullenphoto",19244,109
NYTimes,CzMgBaivqD1,2023-11-03 19:17:16,GraphSidecar,"Ozempic, and drugs like it, have transformed how doctors treat diabetes and obesity. Now, some psychiatrists are turning to the drugs to counteract the weight gain that often comes with nearly all antipsychotics and some drugs used to treat depression and anxiety.

The New York Times heard from 13 leading mental health facilities and psychiatric departments at major health systems in the U.S. Their responses reflect a new debate in mental health care about whether to prescribe a drug patients will most likely take indefinitely, with only a limited understanding of how people with serious mental illness fare on these medications.

Read more about the debate at the link in our bio.

Art by @derekabella",24601,553
NYTimes,CzMRmYyr9zE,2023-11-03 17:12:13,GraphVideo,"Scoring a table in New York can seem impossible, but it may be easier than you think. Here’s how the competition played out for one dinner, with tips from the winning players. 

Want to win the restaurant reservation game? Tap the link in our bio. Video by Priya Krishna, Umi Syam, Ruru Kuo/The New York Times",5803,219
NYTimes,CzMJuSHrGnH,2023-11-03 16:02:25,GraphImage,"November is officially here and that means more books are on the way.

What books should you watch for this month? Tap the link in our bio to get the full list.",5937,72
NYTimes,CzL_UoeLcyq,2023-11-03 14:33:18,GraphVideo,"Each September, the ice at the top of the world hits its lowest extent of the year. Researchers are studying how a warming climate is affecting a not-so-frozen ocean.

Read the full story at the link in our bio. Video by Esther Horvath and Claire Hogan/The New York Times",7145,90
NYTimes,CzL0rZQM0Jq,2023-11-03 13:00:48,GraphImage,"Noa Tishby, once a celebrated actress in Israel, has become a dominant and provocative pro-Israel voice on U.S. television and social media, as well as in print.

She is an unabashed booster of Israel who describes herself as “pro-Palestinian, just anti-Hamas.” She speaks forcefully against a cease-fire in Gaza and against U.S. students and others who have rallied in support of the attack on Israel. Her mission, she says, is to combat global antisemitism and the digital spread of misinformation. To her critics, she can sound like an apologist for the Israeli government. Despite that, she is seemingly everywhere. 

Tap the link in our bio to read the full profile of @noatishby and to learn why she has been described as “the voice of this Jewish generation.” Photo by @markabramsonphoto",46405,8492
