owner_username,url_code,time_utc,type,caption,likes,comments
NYTimes,CzrLIDtv8rX,2023-11-15 17:11:08,GraphSidecar,"Adult children caring for their aging parents are worried about unreliable agencies, dwindling financial resources and a lack of resources for long-term care.

The New York Times and @kffhealthnews, a nonprofit news organization, interviewed families and experts for the “Dying Broke” series, a joint project on long-term care. Those taking care of their parents expressed concern as they watched bills pile up and found themselves having to make difficult decisions about placing their parents in assisted living facilities. “If Mom gets worse and I can’t care for her? That’s something I struggle with,” said Karina Ortega, whose mother was diagnosed with Alzheimer’s in March 2020. She added: “I just can’t see it in me to leave my mom because she needs me.”

Read more at the link in our bio about how adult children are coping with helping their aging parents. Photos by @maansi.photo, @ddrios, @bryan.meltz, @kelburgess, @willcrooksphoto and @michelleagins",5012,84
NYTimes,Czq8ES4LZAX,2023-11-15 14:59:33,GraphImage,"The Israeli military forged ahead with its raid on Gaza’s largest hospital Wednesday afternoon, 12 hours after troops first stormed the complex, in a significant step that could shape the pace and extent of its war with Hamas.

The hospital, Al-Shifa, has become synonymous with Israel’s 40-day effort to wrest control of Gaza from Hamas. Its capture could affect international sentiment about the invasion as well as the continuing negotiations to free the hostages captured by Hamas last month.

A senior Israeli military official said on Wednesday that troops were interrogating people inside the hospital and had found weapons during the raid, but declined to provide evidence or further details because the operation was ongoing. Palestinian officials, the heads of United Nations agencies and some Mideast regional leaders condemned the raid, warning that it risked the lives of Gaza’s most vulnerable.

Few details about the raid were available on Wednesday afternoon, as communications were disrupted in Gaza City. This is a developing story. Tap the link in our bio for live updates.",10336,2545
NYTimes,CzpiOVgRhX1,2023-11-15 01:54:29,GraphSidecar,"Hochatown, on the shores of Broken Bow Lake in the southeast corner of Oklahoma, has a population of just 219 people. But on weekends, as many as 50,000 visitors, mostly from Dallas, flock there to kayak, fly-fish and hike among the waterfalls, rapids and thick forests of pine and pawpaw trees.

Before the Covid-19 pandemic, Hochatown had roughly 400 cabins for rent on Airbnb. There are now more than 2,400 — a staggering 413% increase in five years. Hochatown does not have a single police officer or professional firefighter. There is no sewerage system, no garbage collection, not even sufficient water to handle the proliferation of people and new homes.

What might be called the Airbnb effect has transformed the landscapes — and the economies — of countless small towns across the U.S. Read the full story at the link in our bio. Photos by @shelby_tauber",18584,403
NYTimes,CzpWrz4PjvB,2023-11-15 00:13:39,GraphImage,"Booths, a small chain that has sold groceries in northern England since 1847, announced this week that it would be getting rid of the self-checkouts in all but two of its 28 stores. The chain is bucking a trend that has remade retail shopping around the world over the last 20 years. Booths, which has about 3,000 employees, said in a statement that having its employees interact with customers would provide a better experience.

Do you prefer a cashier to self-checkout? Tap the link in our bio to learn more about the reversal of the self-checkout trend. Photo by @andrew_testa",77456,2058
NYTimes,CzpMGzRP0l4,2023-11-14 22:43:02,GraphVideo,"Families of Hostages Held by Hamas Begin March From Tel Aviv to Jerusalem

About 100 people who are family members and friends of the hostages held by Hamas began a five-day march to Prime Minister Benjamin Netanyahu’s office in Jerusalem.

Tap the link in our bio to read more about the families who are seeking to secure the release of people abducted in the Oct. 7 attack on Israel.",42347,4793
NYTimes,Czo-ArJP2tY,2023-11-14 20:39:00,GraphImage,"Doctors have long relied on a few key patient characteristics to assess risk of a heart attack or stroke, using a calculus that considers blood pressure, cholesterol, smoking and diabetes status, as well as demographics: age, sex and race.

Now, the American Heart Association is taking race out of the equation.

The overhaul of the widely used cardiac-risk algorithm is an acknowledgment that, unlike sex or age, race identification in and of itself is not a biological risk factor.

Learn more about the revision, as well as a broader trend toward removing race from a variety of clinical algorithms within the U.S. health care system, at the link in our bio. Photo by Rocketclips, Inc./Alamy",9069,188
NYTimes,Czoxyfkva89,2023-11-14 18:52:14,GraphVideo,"A Volcano May Erupt in Iceland

Iceland is bracing for a possible volcanic eruption. Since late October, tens of thousands of earthquakes have been reported in the Reykjanes Peninsula, in the southwestern part of the country. At one point there were as many as 1,400 in a single 24-hour period.

On Tuesday, the Icelandic Met Office, the country’s weather service, warned that there was a “significant likelihood of a volcanic eruption in the coming days.” The increased seismic activity and the formation of a nine-mile underground river of magma have led the authorities in recent days to declare a state of emergency and to evacuate the small fishing town of Grindavik, where more than 3,000 people live.

Tap the link in our bio to learn more about what to expect in the event of a volcanic eruption in Iceland.",91149,926
NYTimes,CzoluvGOKxX,2023-11-14 17:05:53,GraphSidecar,"Wondering which turkey is right for your Thanksgiving table? We’ve got you covered. At the link in bio, find an interactive guide that’ll walk you through choosing a turkey (or turkey alternatives), sides and everything else you’ll need for the big day.",4481,59
NYTimes,CzogjYtO9u4,2023-11-14 16:20:39,GraphSidecar,"The U.S. has no coherent system for providing long-term elder care, leaving aging people to rely on a patchwork of solutions. Millions of families are facing daunting life choices and potential financial ruin as the escalating costs of care devour their savings and incomes.

The private market where a minuscule portion of families buys long-term care insurance has shriveled.  Labor shortages have left families searching for workers willing to care for their elders at home.The cost of a spot in an assisted-living facility has soared to an unaffordable level for most middle-class Americans who qualify for nursing home care paid for by the government only after they run out of money. 

The prospect of dying broke looms as an imminent threat for the boomer generation, which has vastly expanded the middle class and looked hopefully toward a comfortable retirement on the backbone of 401(k)s and pensions. The problem is only set to worsen: By 2050, the population of Americans 65 and older is projected to increase by more than 50%, to 86 million, according to census estimates. The number of people 85 or older will nearly triple, to 19 million.

The New York Times and @kffhealthnews, a nonprofit news organization, interviewed dozens of families and experts for the “Dying Broke” series, a joint project on long-term care. Read more at the link in our bio. Photos by @shuranhuang, @arinyoon, @fremson and @willdeshazer",29178,1055
NYTimes,CzoWW_yscYi,2023-11-14 14:51:58,GraphImage,"More than 400 political appointees and staff members representing some 40 government agencies sent a letter to President Biden on Tuesday protesting his support of Israel in its war in Gaza.

The letter, part of growing internal dissent over the administration’s support of the war, calls on the president to seek an immediate cease-fire in the Gaza Strip and to push Israel to allow humanitarian aid into the territory. It is the latest of several protest letters from officials throughout the Biden administration, including three internal memos to Secretary of State Antony Blinken signed by dozens of State Department employees as well as an open letter signed by more than 1,000 employees of the U.S. Agency for International Development.

The letter, a copy of which was reviewed by The New York Times, began by denouncing the Oct. 7 attacks by Hamas, then urged Biden to stop the bloodshed caused by Israel’s retaliatory military campaign in Gaza. Read the full story at the link in our bio",94775,4313
NYTimes,Czm6hAGR6wj,2023-11-14 01:29:02,GraphImage,"Six trees made famous by the series “Game of Thrones” will be cut down in the coming weeks, officials in Northern Ireland said on Monday.

The trees are part of the Dark Hedges, an international tourist attraction for fans of the HBO series. The beech trees, which form an arch over a road with long branches that twist up to the sky, have become one of the most photographed spots in Northern Ireland, with hundreds of tourists visiting on some days.

The trees that make up the Dark Hedges, which sit on privately owned land, were planted by the Stuart family in the 18th century. There were originally about 150 trees, but today just 86 remain, with some having been damaged in storms or by rot.

Read more about the Dark Hedges at the link in our bio. Photo by @hazelthompsonphoto",57707,410
NYTimes,Czmp8NYuimF,2023-11-13 23:05:13,GraphVideo,"Watch @ericjoonho make his version of green bean casserole after testing 13 recipes. Tap the link in bio to check it out, now on YouTube.",10103,247
NYTimes,CzmmVRrvDlt,2023-11-13 22:33:48,GraphVideo,"Gaza Hospitals ‘Must Be Protected,’ Biden Says

The Gaza Strip’s hospitals “must be protected,” President Joe Biden said on Monday as Israeli troops battled to seize control of what Israel says is a Hamas command complex that lies below the enclave’s main medical facility, Al-Shifa Hospital.

Thousands of people fled Al-Shifa over the weekend as Israeli troops encircled it. On Monday, the World Health Organization warned of a “dire and perilous” situation for patients. The health organization said in a statement that Al-Shifa “is not functioning as a hospital anymore,” after having run out of fuel and water, putting the lives of patients at risk.

For the latest updates, tap the link in our bio.",20689,4662
NYTimes,CzmY6_IuBDP,2023-11-13 20:35:29,GraphSidecar,"Around 53 million Americans are caregivers for a family member or friend with a health issue or disability, and nearly a third spend 20 or more hours a week in that role. Looking after a sick family member can mean putting your own life on hold, often with little recognition or outside support.

The Centers for Disease Control and Prevention, which calls caregivers the “backbone” of long-term home care in the U.S., has warned that caregivers face many risks, including anxiety, depression, chronic health conditions and financial strain. Yet experts said that many caregivers feel they cannot speak openly about their frustration and anger, and that it is important to normalize those feelings.

Read more about the quiet rage of caregivers — and how some seek community support — at the link in our bio. Photos by @markabramsonphoto",48651,562
NYTimes,CzmHuicuFwX,2023-11-13 18:05:14,GraphImage,"Gaza’s main hospital is “no longer functioning,” according to the World Health Organization, which warned of a “dire and perilous” situation for hundreds of patients and displaced people trapped inside as Israeli troops battle Hamas fighters nearby.

Dozens of corpses are decomposing at the Al-Shifa Hospital because there is no way to preserve or remove them, a head nurse and a health official said.

The hospital and other medical centers in Gaza City had been struggling for weeks to maintain operations as supplies of fuel and medicine dwindled. The Health Ministry, which is controlled by Hamas, said on Monday that Israeli military vehicles had advanced to the gates of the hospital complex.

Patients at Al-Shifa have been dying because of a lack of power, according to doctors and Gazan health officials. Jihan Miqdad, a head nurse in the emergency room at Al-Shifa, said in a phone interview on Monday that patients who were on life support in the intensive care unit were dying because there was no oxygen.

“The situation here is catastrophic in every sense of the word,” she said.

Israeli security officials say that Hamas has built a vast command complex under the hospital, making it a legitimate military target. Hamas has denied the allegations, as has Al-Shifa’s director, Dr. Mohammed Abu Salmiya, who has called them “untrue.”

A spokesman for the Gazan Health Ministry, Dr. ​​Medhat Abbas, said in a phone interview that more than 100 bodies were lying in the hospital’s front yard, another 50 were inside and around 60 were in the morgue.

This is a developing story. For the latest updates go to the link in our bio.",21771,3290
NYTimes,Czl-hIQuoSX,2023-11-13 16:44:45,GraphSidecar,"Understanding the reality of Texas matters. With a population of over 30 million, the state is increasingly shaping the cultural and political direction of the country. Its economy is one of the largest in the world, growing faster than even the nation’s.

Texas has long been defined by demographic changes, particularly its expanding Hispanic population. But the nature of those changes, and how profound they have become, has often been misunderstood, even by those who follow the state closely.

The New York Times collected years of census data, analyzed migration patterns and traveled to communities across Texas to understand what is happening in the state – the nation’s second most populous – a place that offers an important window into the future of both national politics and the attempts to deal with questions of identity and diversity.

Read more about how Texas is changing at the link in our bio. Photos by @ddrios, @meridithkohut and @townsend.___",42352,695
NYTimes,CzlqaKGL7Px,2023-11-13 13:49:03,GraphSidecar,"South Africa is the most industrialized African country and was once considered an economic success story. But it has one of the highest youth unemployment rates in the world: 61% of people aged 15 to 24 are unemployed. The overall unemployment rate is 33%, and for high school graduates it’s 35%.

If South Africa, which has the most developed economy in Africa, cannot create enough jobs, economists warn, then how are poorer countries on the continent going to generate opportunities for their booming youth populations?

Read part two of a series on how the African youth boom is changing the continent, and beyond, at the link in our bio. Reporting by @lynseychutel and photographs by @gulshanii",13775,393
NYTimes,CzkSsrDsZ0l,2023-11-13 01:05:04,GraphVideo,"Working on a remote island, scientists think they can use genetic engineering to block a malaria-carrying species of mosquito from spreading the disease — and do it in just a few months. But governments are wary. Our global health reporter, @snolenglobal, reported this story from the country of São Tomé and Príncipe in the Gulf of Guinea.

Tap the link in our bio to read more about this experiment. Video by Stephanie Nolen and Karen Hanley/The New York Times",6758,205
NYTimes,CzkDxpIOI69,2023-11-12 22:52:13,GraphSidecar,"In the Rockaways, a low-lying peninsula in Queens that separates the Atlantic Ocean from Jamaica Bay, life has long been shaped by the tides. High-tide floods are not caused by the weather but by the twice monthly alignment of the Earth, sun and moon. When there is a full or new moon, the sun and moon exert a gravitational pull that forces tides to swell.

But as climate change causes sea levels to rise, high-tide floods — sometimes called nuisance floods or sunny-day floods because they can happen on clear days — are likely to inundate more coastal neighborhoods across the five boroughs.

As high-tide floods become more frequent, New Yorkers are asking themselves: When does a place become unlivable? Tap the link in our bio to read more about the problem and how the city is responding. Photos by @dave_sanders",25123,275
NYTimes,Czj2lk8uyvr,2023-11-12 20:59:51,GraphVideo,"Army Ammunition Plant Is Tied to Mass Shootings Across the U.S.

Lake City Army Ammunition Plant in Independence, Missouri, was built during World War II and has made nearly all the rifle cartridges used by the U.S. military since it pulled out of Vietnam.

In recent years, it has also pumped billions of rounds of military-grade ammunition into the commercial market, an investigation by The New York Times found, leaving the “LC” signature scattered across crime scenes, including the sites of some of the nation’s most heinous mass shootings.

The plant, operated by a private contractor with Army oversight, is now one of the country’s biggest manufacturers of commercial rounds for the popular AR-15, and it remains so even as the U.S. government supplies ammunition to Ukraine.

A vast majority of Lake City rounds sold by retailers have been purchased by law-abiding citizens, including hunters, farmers and target shooters. Some of those people are drawn to the ammunition because it’s made with the same materials, and often to the same specifications, as the military’s. Others see the rounds as authentic accessories for their tactical weapons and gear.

But more than one million pages of search warrants, police evidence logs, ballistics reports, forfeiture records and court proceedings compiled by The Times provide a sweeping accounting of how Lake City ammunition, once intended for war, has also cut a criminal path through towns and cities in nearly all 50 states.

Read more about the findings at the link in our bio.

Video by Ben Dooley, @claire_sandwich and @ekrhyne",11467,935
NYTimes,CzjgZMBuAhq,2023-11-12 17:43:03,GraphSidecar,"Chelsie Hill was a champion dancer when a night in February 2010 changed her life. She was in a serious car accident that left her with severe spinal injuries and unable to move her lower body.

Hill is the founder of the Rollettes, a dance team formed in 2012 for women who use wheelchairs. They perform all over the country and host an annual empowerment weekend in Los Angeles for women with disabilities called the Rollettes Experience.

Reclaiming her story as both a dancer and a wheelchair user meant finding others like her. She achieved what she set out to do, creating an unrepentantly girlie sisterhood that supports others.

Read more about @chelsiehill and the @rollettes_la at the link in our bio. Photos by @magdawosinskastudio

This post has been edited to correct a timeline discrepancy.",22425,153
NYTimes,CzjSNMxr2CF,2023-11-12 15:39:05,GraphSidecar,"Where do we go when we die? 

For these seven people, the answer is space. They have chosen to send their ashes, or a sample of their DNA, into orbit, to the moon or simply hurtling into space. They settled on their final wishes for different reasons: spiritual, pragmatic, romantic. Many consider it the culmination of a lifelong fascination with space exploration, the impulse to look up with wonder. Lemuel Patterson, 71 (Photo 1), has always been enraptured by space and wants to be buried up there.  For others, a space burial signals acceptance of the idea that, in the end, there may be only a void awaiting us. 

To read their stories, tap the link in our bio. Photos by @dina_litovsky",18003,277
NYTimes,CzjGd0huF_T,2023-11-12 13:56:29,GraphSidecar,"The new crop of e-cigarettes represents an about-face from the more subdued look of its predecessors. That has experts concerned.

The understated look associated with Juul has been supplanted by the rounded, vivid designs of Elf Bars and other brands, whose color schemes often correspond with their flavors. Some public health experts are concerned that these devices’ playful appearance — which is neatly in line with the maximalist aesthetic preferences of many members of Gen Z — may offer appealing new cover for nicotine products.

Each Elf Bar contains as much nicotine as 590 cigarettes, according to one estimate. Doctors say that nicotine is especially addictive for young people, and research suggests that teenage vapers risk both immediate and long-term lung damage.

Tap the link in our bio to read more about how these products are geared to catch the eyes of young people. Photo illustration and photos by @ok__mccausland",94237,1712
NYTimes,Czhu9BZO0LX,2023-11-12 01:11:48,GraphSidecar,"Vietnam is having a cable car bonanza. The country is home to four of the longest cable cars in the world, and some 26 cable car lines have been built in a dozen locations across Vietnam over the past two decades.

Vietnam’s abundance of mountains, jungles and islands makes cable cars a natural fit since they can be built faster, cheaper and with less environmental damage than roads. But the cable cars are typically parts of mass-tourism complexes, and some travelers, citizens and environmental activists see them as scars on the landscape and a symptom of rampant overdevelopment by powerful conglomerates. Environmentalists are also anxious over the vision for Cat Ba Island from the Sun Group, one of the communist country’s biggest real estate and tourism developers. The on-again, off-again plans include a network of cable cars, a resort, a golf course and a cruise ship port, all in an area designated by UNESCO as a Biosphere Reserve.

Tap the link in our bio to read more about this booming mode of transportation in Vietnam. Photos by @askmott",21619,165
NYTimes,Czhe_C9O-nn,2023-11-11 22:53:48,GraphVideo,"‘Is It Good Enough to Fool My Gallerist?’

David Salle, one of America’s most thoughtful painters, hoped an AI program could nourish creativity. For nearly a year, the painter has tried to defy conventional thinking about generative artificial intelligence by testing an AI program’s capacity to become a sophisticated creator of art.

Salle held weekly meetings with two technologists, Danika Laszuk and Grant Davis, who tailored a text-to-image model to the painter’s requirements, relying on descriptive prompts that generated images in the artist’s style. The New York Times observed three of their work sessions, tracking the algorithm’s progress over several months as it adopted more of Salle’s techniques and abandoned the bland photorealism that often limits other generative programs.

Tap the link in our bio for more from Zachary Small, a culture reporter for The New York Times, who explained Salle’s approach to AI. Video by @zacharyhsmall, @claire_sandwich and @rurukuooo",5918,247
NYTimes,CzhStXAuOmq,2023-11-11 21:04:59,GraphSidecar,"Taylor Swift’s Eras Tour officially went global on Thursday when the pop megastar began a new phase of shows that would take her to 25 cities across South America, Asia, Australia and Europe over the next 10 months.

Since March, the North American stretch of the tour has become an economic marvel and a cultural force, cementing Swift’s status as one of the most influential, and beloved, people on the continent. Now, she is set to demonstrate that her fame and adoration go well beyond borders.

There are few countries better to display the intense passion of her fans than Argentina. While Swift has become a certified global icon, Argentina has become known for worshiping icons with religious fervor.

Tap the link in our bio to read more about the dedicated Swifties in Argentina. Photos by @_sarahpabst_",231476,2428
NYTimes,Czg527-uHj3,2023-11-11 17:29:23,GraphVideo,"They Left Gaza to Work in Israel. Now They’re Stranded.

Thousands of workers from Gaza have been trapped in the West Bank since the Hamas attacks on Oct. 7. Their Israeli work permits have been canceled, and they’re deeply worried about their families back home. “I have no idea if my own four kids are alive or dead,” Jihad Al-Aaf, one Gazan worker trapped in the West Bank, said. “I try calling, but they don’t answer.”

Video by Matthew Cassel, Ayman Abu Ramouz and Caroline Kim",21352,2616
NYTimes,CzguVKWO-mQ,2023-11-11 15:47:07,GraphSidecar,"Nearly a million miles away, the James Webb telescope just took a picture. Since transmitting its first data, it has made stunning discoveries, including a plume of water spanning 6,000 miles and a galaxy that formed more than 13 billion years ago.

The telescope is an engineering marvel: Its massive mirror makes it possible to collect light from the faintest objects. It has multiple ways of blocking and dissecting that light, giving us detailed portraits of distant galaxies and close neighbors alike.

What’s it showing us about the future of cosmology – and our own past? ​​Tap the link in our bio to find out. From @nytmag with photos by @nasa",125718,472
NYTimes,CzghmCoOo3C,2023-11-11 13:55:49,GraphImage,"It's getting chilly out there, and you know what that means: @clarkbar's Mushroom Bourguignon. Recipe is at the link in bio! Photo by @dmalosh, with food styling by @simoncooks",38778,247
