owner_username,url_code,time_utc,type,caption,likes,comments
WashTimes,Cy1BD_JMhX1,2023-10-25 16:24:15,GraphSidecar,"President Biden and former President Donald Trump are tied with 37% of voter support, according to a new poll.⁠
⁠
Swipe 👉️ to learn more.",44,18
WashTimes,Cy05WCdsqU8,2023-10-25 15:19:06,GraphVideo,"On Wednesday's Front Page: Louisiana Rep. Mike Johnson is Republicans fourth nominee for speaker in the last three weeks, Israel faces a fierce backlash from its critics and friends amid a rising civilian death toll, and more.",19,2
WashTimes,Cy0paUONoBQ,2023-10-25 12:59:20,GraphVideo,"#TopoftheTimes: Self-driving taxis are under investigation

Tune in as The Washington Times' Tim Constantine discusses today's top stories.",19,1
WashTimes,CyzK0v5NR9t,2023-10-24 23:11:09,GraphImage,Biden bets on border money to entice Republicans on $105 billion spending bill⁠,39,13
WashTimes,CyzDK2LLlVz,2023-10-24 22:07:08,GraphVideo,"""We're going to continue to try to get that humanitarian assistance in and we're going to continue to try to get hostages and people out of Gaza appropriately. And as I think you've heard us say, a cease fire right now really only benefits Hamas,"" said National Security Council spokesman John Kirby.",90,32
WashTimes,Cyy7YZ2Jdk5,2023-10-24 20:56:17,GraphImage,White House press secretary Karine Jean-Pierre on Tuesday declared her opposition to antisemitism one day after she was criticized for deflecting a question about an uptick in attacks on Jewish people by condemning hate crimes against Muslims.,79,5
WashTimes,CyyzfALMgj9,2023-10-24 19:47:13,GraphImage,"The Biden administration just tallied the worst year in border security history, according to the Department of Homeland Security’s final numbers for fiscal 2023, which showed record numbers of illegal immigrants, terrorism suspects and fentanyl detected.",40,12
WashTimes,CyysGhLOTD5,2023-10-24 18:43:12,GraphVideo,"Democrats say they have the best interests of women and children at heart, but how can that be when their most consistent fight is one that undervalues the role of motherhood while outright killing God's creations? Babies are not political tools to gain votes; abortion is not a private choice between a woman and her doctor. And guess what -- the science the Democrats so love to cite when it suits their ambitions and purposes is very clear on what takes place in the womb, and how a baby develops and grows. Leftists can't get by with calling a baby a bunch of cells any more. Frank Pavone, national director of Priests for Life, discusses the Supreme Court, abortion and why some Democrats say they love God, yet still support abortion.",26,2
WashTimes,Cyyj6oGS_8f,2023-10-24 17:31:31,GraphImage,From Washington Times Opinion Editor Charles Hurt: Biden funding two new wars,73,4
WashTimes,CyycPrRMYZ3,2023-10-24 16:24:09,GraphImage,"Israel’s window of opportunity to launch a decisive ground assault on Hamas Palestinian militants seemed to narrow Monday with reports of growing impatience over the long-awaited offensive, while the Biden administration privately advised Israel that waiting a bit longer could result in the safe return of more hostages held in the Gaza Strip.",24,3
WashTimes,CyyUf_VM0xD,2023-10-24 15:19:24,GraphVideo,"On Tuesday's Front Page: Israel’s window of opportunity to launch a decisive ground assault on Hamas has seemed to narrow, D.C. Mayor Muriel Bowser has introduced legislation aimed at rolling back some of the city’s anti-police rules, and more.",16,2
WashTimes,CyyMkgSMU1O,2023-10-24 14:07:17,GraphImage,House Republicans were as divided as ever after hearing from eight candidates for speaker in a closed-door meeting in the Capitol. But they nonetheless planned to nominate a single candidate by Tuesday whom they hope could win the backing of 217 GOP lawmakers in a floor vote later this week.,22,7
WashTimes,CyyE3i_pXDZ,2023-10-24 13:00:11,GraphVideo,"#TopoftheTimes: Will Russia restart nuclear tests?

Tune in as The Washington Times' Tim Constantine discusses today's top stories",24,1
WashTimes,Cyx9lRKMIpb,2023-10-24 11:56:12,GraphImage,"Fall into digital subscription savings 🍂⁠
⁠
Follow the link in bio to subscribe and save.",14,1
WashTimes,CyweXXRMnPn,2023-10-23 22:04:12,GraphImage,"China’s rapid buildup of missiles, bombers, submarines and nuclear warheads is continuing apace with no announced end goal as part of a drive by the Chinese Communist Party to replace the United States as the world’s sole superpower, according to the Pentagon’s annual report on Chinese military power.",119,33
WashTimes,CywWlEBv_ha,2023-10-23 20:56:09,GraphImage,"Ford said it will fire more workers in Michigan a week after thousands of workers walked off the job at the company’s Louisville, Kentucky, plant.⁠
⁠
According to the auto giant, around 150 workers will be furloughed as a result of the United Auto Workers strike, which has jarred Ford’s economic outlook. The latest firings bring the total number of layoffs at the company to 2,730 since the strike began in September.",32,4
WashTimes,CywG51Uy29d,2023-10-23 18:39:14,GraphImage,"Former President Donald Trump has been logging as much time in the courtroom as he has on the campaign trail, a potential obstacle that he is turning to his advantage.⁠
⁠
Since the beginning of October, Mr. Trump has spent four days campaigning — in Iowa, New Hampshire and Florida — and four days stewing alongside his defense attorneys in a Manhattan courtroom.",110,10
WashTimes,Cyv_Hs_y6Jf,2023-10-23 17:31:10,GraphImage,Mr. Biden has requested a $100 billion military aid package for Israel and Ukraine that includes humanitarian assistance. It also includes funding for the U.S. southern border with Mexico to combat illegal immigration and Taiwan to combat China’s aggression.,140,51
WashTimes,Cyv3ddNS1c7,2023-10-23 16:24:14,GraphImage,"House Republicans will meet behind closed doors Monday to debate who to nominate followed by a secret ballot on Tuesday. Republicans hope to then be able to hold a floor vote on the nominee.⁠
⁠",58,21
WashTimes,CyvwCA-tzA0,2023-10-23 15:19:51,GraphVideo,"On Monday's Front Page: A wider Middle East war is growing more likely as Israel pounded Hamas targets in the Gaza Strip, the field to become the next speaker of the House has swelled to nine Republican candidates, and more.",26,2
WashTimes,CyvnxehsFWq,2023-10-23 14:07:11,GraphImage,"Both James Biden and the president’s son Hunter Biden often leveraged Mr. Biden’s name to win hugely profitable deals. According to Hunter’s former business partners, Mr. Biden showed up at Hunter Biden’s business meetings or phoned in to them.⁠
⁠
Court documents and congressional reports show that James Biden wasn’t shy about promoting his brother’s influence. He told potential business partners in 2019 that his brother Joe “was in the room with him” as he closed a deal.",222,41
WashTimes,Cyvf0rgtqyS,2023-10-23 12:58:47,GraphVideo,"#TopoftheTimes: Senator Menendez skips classified briefings following charges for acting as a foreign agent.

Tune in as The Washington Times' Tim Constantine discusses today's top stories.",36,4
WashTimes,CypDUWEuFaE,2023-10-21 00:53:09,GraphImage,"A federal inspector general has opened an investigation into telework policies that have turned some government offices into ghost towns, risking the spread of disease and raising questions about how agencies deliver services.",68,9
WashTimes,Cyo6vS5Mkf1,2023-10-20 23:38:15,GraphImage,"Most people in the U.S. see Mexico as an essential partner to stop drug trafficking and illegal border crossings, even as they express mixed views of Mexico’s government, according to a new poll.",46,10
WashTimes,Cyop6iTsplV,2023-10-20 21:11:11,GraphImage,"U.S. military personnel and commercial pilots reported at least 291 UFO sightings since August 2022, the Pentagon said in a report released late Wednesday, with some of the craft exhibiting “high-speed travel,” “unusual maneuverability” and other strange characteristics.",31,5
WashTimes,CyohcVogu6B,2023-10-20 19:57:09,GraphImage,"At a time when Americans are deeply divided along party lines, a new poll shows considerable agreement on at least one issue: The United States’ two-decade-long war in Afghanistan was not worth fighting.",47,9
WashTimes,CyoY_DOM2p5,2023-10-20 18:46:09,GraphVideo,"It's more than Republicans versus Democrats out there. We're in a battle for the good of this nation -- against the evil that wants to totally undo this nation. It's more a spiritual war than a political battle that's dividing Americans on so harsh of lines, and once we realize that without God, the war cannot be won, then we can fight more effectively.",59,5
WashTimes,CyoQghuMheC,2023-10-20 17:29:11,GraphImage,"“The data is a reminder that hate never goes away, it only hides,” Mr. Biden said. “Any hate crime is a stain on the soul of America.”",50,4
WashTimes,CyoHsbWMrhT,2023-10-20 16:12:09,GraphImage,"“History has taught us when terrorists don’t pay a price for their terror, when dictators don’t pay a price for their aggression, they cause more chaos and death and more destruction,” Mr. Biden said. “They keep going, and the cost and threats the American people keep rising.”",61,7
WashTimes,Cyn-d_LtUbf,2023-10-20 14:51:41,GraphVideo,"On Friday's Front Page: President Biden laid out his case to the country and Congress that the U.S. must send $100 billion of aid to Israel and Ukraine, Sidney Powell has pleaded guilty to conspiring to interfere with election results, and more.",28,1
WashTimes,CynvNQDs03R,2023-10-20 12:38:11,GraphImage,Fall into digital subscription savings!,19,2
WashTimes,CymfqvxtxVl,2023-10-20 01:03:11,GraphImage,"Breaking Down America's Sweet Tooth 🍬⁠
⁠
How much are Americans planning to spend on Halloween candy this year?",36,6
WashTimes,CymYHtzhR9U,2023-10-19 23:57:13,GraphImage,"China is engaged in a systematic program of military intimidation and coercion involving dangerous jet intercepts of U.S. and allied aircraft that could trigger a U.S.-China conflict, the Pentagon’s senior policymaker for Asia said.",46,13
WashTimes,CymQVSINgRG,2023-10-19 22:49:11,GraphImage,"President Biden is clinging to young voters and making inroads with seniors while former President Donald Trump is attracting middle-aged voters battling inflation and other stressors before retirement, according to early polls that show age is a key indicator of how Americans plan to vote in 2024.",106,31
WashTimes,CymIjUFPPSg,2023-10-19 21:41:18,GraphImage,"Left-wing political commentator Cenk Uygur has joined a growing list of Democratic and liberal challengers to President Biden’s reelection run, and he is challenging the Constitution’s requirement that the president be a natural-born U.S. citizen.⁠
⁠
Mr. Uygur was born in Turkey and became a naturalized U.S. citizen. He created “The Young Turks,” a left-wing news commentary show on YouTube, and co-founded the Justice Democrats political action committee, which works to elect far-left candidates to Congress.",115,24
WashTimes,Cyl5N8rJPXB,2023-10-19 19:27:11,GraphImage,"The IRS is pushing ahead with plans for its own version of a free direct-file option, announcing it will run a 13-state pilot program for next year that will allow a limited number of taxpayers to fill out and submit their tax returns online without having to use a paid service.",69,4
WashTimes,Cylxb3DSxEE,2023-10-19 18:19:11,GraphImage,"Defense Secretary Lloyd Austin on Tuesday issued “prepare to deploy” orders for about 2,000 personnel for possible support of Israel, Pentagon officials said.⁠
⁠
The Defense Department said select military units are in a heightened state of readiness, which improves the Pentagon’s ability to quickly respond to the security situation in the Middle East.",60,6
WashTimes,Cylpps7Avoe,2023-10-19 17:11:10,GraphImage,"Rep. Jim Jordan, the Republicans’ nominee for House speaker, is putting his bid for the gavel on hold after spending days unsuccessfully trying to convince GOP holdouts to back him.⁠
⁠
House Republicans are now debating a backup plan: Voting to give appointed temporary Speaker Patrick McHenry of North Carolina the power to legislate, which he now lacks under the rules of the House.",71,12
WashTimes,Cylh4E1s6gR,2023-10-19 16:03:14,GraphImage,"Kamala Harris’ college tour confronted by the left’s pro-Palestinian young voters⁠
⁠",95,27
WashTimes,CylaVvurBOp,2023-10-19 15:00:43,GraphVideo,"On Thursday's #FrontPage: President Biden walked a diplomatic tightrope on a high-stakes trip to Israel, a federal inspector general has opened an investigation into telework policies that has left some government office buildings vacant, and more.",25,1
WashTimes,CylSiNisHne,2023-10-19 13:49:13,GraphImage,A Capitol Police spokesperson told The Washington Times that three of the demonstrators were arrested and charged with assault on a police officer. ⁠,92,21
WashTimes,CylKjZstKFg,2023-10-19 12:40:39,GraphVideo,"#TopoftheTimes: UAW workers oppose the building of EV plants.

Tune in as The Washington Times' Tim Constantine discusses today's top stories.",31,2
WashTimes,Cyjb-SWsnnR,2023-10-18 20:33:09,GraphImage,"“That Tiktok challenge of how to steal the Kias and Hyundais, that was the biggest thing,” Matt Nalett, who operates the volunteer-run Chicago Stolen Car Directory on Facebook, told WTTW-TV in August. “And kids are like, ‘We got nothing to do, let’s steal cars.’ When they were out that two years of COVID, they were bored and had nothing to do and stealing cars left and right.”",31,4
WashTimes,CyjTKnBSsmb,2023-10-18 19:16:14,GraphImage,"Republicans at 54% sided with Israel’s position more than Democrats at 37%.⁠
⁠",56,9
WashTimes,CyjE3BDM_RS,2023-10-18 17:14:03,GraphVideo,President Biden said Wednesday that U.S. intelligence corroborates Israel‘s claim that it was not to blame for the deadly explosion at a Gaza hospital that killed 500 people and sparked mass protests in Arab nations.,129,34
WashTimes,Cyi9FdDSUC6,2023-10-18 16:03:17,GraphImage,Republican lawmakers are demanding assurances that Homeland Security Secretary Alejandro Mayorkas won’t attempt a repeat of the Afghanistan airlift fiasco with Palestinians seeking to flee the war between Israel and Hamas.,144,20
WashTimes,Cyi1iTzMiZE,2023-10-18 15:00:46,GraphVideo,"On Wednesday's #FrontPage: Republicans tried, but failed, to elect a new speaker of the House, leaving the chamber on the verge of a third week in limbo, Israel has ramped up airstrikes against Hamas targets in Gaza, and more.",29,2
WashTimes,Cyitv08A4r6,2023-10-18 13:49:13,GraphImage,"Mr. Biden’s remarks back Israel‘s claim that it wasn’t responsible for the attack, but also underscores how quickly the situation is evolving. In a statement on the attack Tuesday, Mr. Biden said his national security team would “continue gathering information about exactly what happened.”",116,19
WashTimes,CyilzS-NyeJ,2023-10-18 12:40:43,GraphVideo,"#TopoftheTimes: Pentagon schools outperform public schools.

Tune in as The Washington Times' Tim Constantine discusses today's top stories",39,1
WashTimes,CyhTOYAIa0u,2023-10-18 00:38:15,GraphImage,"The Emerson College Polling Survey shows a race in which Mr. Biden generally holds an edge over Mr. Trump, the clear Republican front-runner. Yet the numbers are much tighter than Democrats would like as the ex-president battles a series of civil and criminal cases.",168,88
WashTimes,CyhLGP-tN3p,2023-10-17 23:27:17,GraphImage,"“We’re the United States of America, for God’s sake. The most powerful nation in the history of the world. We can take care of both of these and still maintain our overall international defense,” Mr. Biden said.",106,55
WashTimes,Cygz3PqMvXH,2023-10-17 20:04:11,GraphImage,"With a humanitarian crisis growing in Gaza and escalation concerns mounting, the Biden administration scrambled through the weekend to try to calm regional nerves while attempting to deter Iran and Hezbollah from further provocations.",100,32
WashTimes,CygsVJHyCkJ,2023-10-17 19:01:07,GraphVideo,"If this White House weren't so weak, then Hamas terrorists wouldn't have risen up when they did, breached Israel's boundaries, and abducted and murdered hundreds. But when the president of the United States can't barely stand and walk by himself, the evil forces of the world take notice and plot ways to exploit the situation. ⁠
⁠
Lt. Col, Tony Shaffer, retired, talks about the many, many problems from this administration that have contributed to the rise of terror and the world of chaos that now confronts us all.",121,18
WashTimes,CygkLmWs5NZ,2023-10-17 17:47:13,GraphImage,"“Hamas is winning the YouTube war,” said Michael Doran, senior fellow and director of the Center for Peace and Security in the Middle East at the Hudson Institute. “The spectacle of civilian casualties in Gaza — it’s having a much bigger effect in the Muslim world than the atrocities Hamas perpetrated” in its attack on Israel.",147,34
WashTimes,CygcZgrMKL1,2023-10-17 16:39:11,GraphImage,"President Biden strode into office promising to restore competency and credibility to U.S. foreign policy after four years of President Trump’s shoot-from-the-hip diplomacy, but several international missteps and crises abroad have undermined his claim.⁠
⁠",275,30
WashTimes,CygUdsLt95c,2023-10-17 15:31:08,GraphVideo,"On Tuesday's Front Page: Ohio Rep. Jim Jordan is still working to persuade Republican holdouts to vote for him for speaker, the FBI says murders, rapes and assaults dropped nationally over the past year, and more.",24,0
WashTimes,CygM8_OM_A9,2023-10-17 14:24:10,GraphImage,"House investigators Monday sought access to the trove of classified documents improperly taken and stored by President Biden, to determine if the sensitive material was used in connection with the Biden family’s lucrative foreign business deals.⁠
⁠",174,17
WashTimes,CygFQhOtK34,2023-10-17 13:18:12,GraphVideo,"#TopoftheTimes: Labor Department sitting on a $5 billion of leftover taxpayer money.

Tune in as The Washington Times' Tim Constantine discusses today's top stories.",35,2
WashTimes,CyfALcYtORE,2023-10-17 03:13:22,GraphImage,"The Biden campaign on Monday joined Truth Social, the web platform launched by former President Donald Trump in hopes of converting supporters of the former commander-in-chief into Biden voters.",112,21
WashTimes,Cye4RD7qXza,2023-10-17 02:04:12,GraphImage,"The Biden administration has reached a settlement with migrant parents whose children were separated under President Trump’s zero-tolerance border policy, promising them housing, medical care, trauma therapy, work permits and legal assistance to help them win a permanent place in the U.S.",125,57
WashTimes,CyewtleM89I,2023-10-17 00:58:11,GraphImage,"Former President Donald Trump is sketching out a second-term agenda on the campaign trail that includes reversing President Biden’s policies, finishing business from his first term and pursuing some outside-the-box ventures such as establishing “freedom cities” across the U.S.",219,30
WashTimes,CyepJ-HMwpg,2023-10-16 23:52:09,GraphImage,"For unionized carworkers, the plant is a potential threat to their job security. Many auto employees represented by the United Auto Workers work in factories building transmissions and gasoline-powered engines, things that are obsolete in a fully electric auto industry.",36,6
WashTimes,Cyeh8kAMImi,2023-10-16 22:49:09,GraphImage,"The report based its estimates on a sampling of national health surveys, including ambulance data. It offers the most recent government data on the “characteristics and differences” of assault victims who rely on emergency services, said Danielle Davis, a CDC health statistician and the report’s co-author.",36,8
WashTimes,CyeZt0RLiPb,2023-10-16 21:37:15,GraphImage,"The law requires an annual cost-of-living adjustment for benefits, based on rising prices. This year’s 3.2% COLA is lower than that of the last two years, when runaway inflation sent costs soaring.",43,4
WashTimes,CyeSjjXstAI,2023-10-16 20:34:44,GraphVideo,"""So we get the speaker, we get the house open and we get to work on the resolution and supplemental for Israel and we get back to work for the American people. That's what I'm committed to doing. And I think it's going to happen tomorrow,"" said Representative Jordan.",79,8
WashTimes,CyeKYLwujvk,2023-10-16 19:23:12,GraphImage,"Florida Gov. Ron DeSantis met 270 US. citizens fleeing the Israel-Hamas war at Tampa International Airport Sunday night.⁠
⁠
The flight was coordinated by Project Dynamo, a Tampa-based nonprofit made up of U.S. military veterans who do international search and rescue missions. The mission was called Operation: PROMISED LAND, which got the Americans, including 91 children plus two dogs, back from Israel, according to the group’s post on X.",166,13
WashTimes,CyeCec0sHHA,2023-10-16 18:14:11,GraphImage,"The IRS dropped the numbers into a raging debate in Washington over how aggressive the IRS should be in sweating out more money from Americans.⁠
⁠
The Biden administration is pushing for an aggressive approach, saying the wealthy aren’t paying their share, while Republicans are resisting, warning that a supercharged IRS would oppress even law-abiding taxpayers.⁠",39,5
WashTimes,Cyd7PknMi0W,2023-10-16 17:10:57,GraphImage,"Former Utah Gov. Jon Huntsman and his family will no longer donate to the University of Pennsylvania, his alma mater, the latest blow to the Ivy League school from a donor and alumni revolt over antisemitism on campus.⁠
⁠
Mr. Huntsman said in a message to Penn President Liz Magill that the Huntsman Foundation “will close its checkbook on all future giving to Penn” after three generations of support from the family, citing the university’s silence in the face of “historic Hamas evil.”",455,36
WashTimes,CydzZjmMWCt,2023-10-16 16:05:08,GraphVideo,"On Monday's Front Page: The Iran-backed militant group Hezbollah launched at least five anti-tank guided missiles into northern Israel, Texas Gov. Greg Abbott is stepping up his migrant busing campaign, and more.",26,2
WashTimes,Cydr2DIs13t,2023-10-16 14:56:18,GraphSidecar,"More than a dozen House lawmakers, mostly Democrats, declined to endorse a resolution to condemn the “barbaric war” launched by Hamas terrorists against Israel.⁠
⁠
The absence of their names from the resolution does not necessarily mean they won’t vote for its passage, but it puts them in a small class of their own that is out of step with more than 400 of their colleagues.⁠
⁠",63,7
WashTimes,CydjXrKt3N3,2023-10-16 13:47:29,GraphVideo,"#Topofthetimes: Nikki Haley is building momentum.

Tune in as The Washington TImes' Tim Constantine discusses today's top stories.",40,4
WashTimes,CydfOvFsnCF,2023-10-16 13:06:11,GraphImage,"Fall into digital subscription savings!⁠
⁠
Follow 🔗 in the bio to subscribe and save.",28,1
WashTimes,CyXLQtXsl9X,2023-10-14 02:16:14,GraphImage,Today's Washington Times #huntertoon:,232,25
WashTimes,CyXCyPdogNV,2023-10-14 01:02:11,GraphImage,"Kari Lake, a close ally of former President Donald Trump, filed paperwork last week to run and will officially launch her campaign Tuesday evening at an event in Scottsdale. She met with several top Senate Republicans on Capitol Hill last week amid concerns that her history of stolen election claims and unsuccessful bid for governor will cost the GOP the battleground seat that could determine control of the chamber.",118,22
WashTimes,CyWvNras2rF,2023-10-13 22:11:12,GraphImage,"The Labor Department‘s pandemic-era “first week” unemployment benefit program has been shut down for two years, but the department is still hoarding nearly $5 billion in cash that never got spent.⁠
⁠
Now an inspector general says it’s time to return the money to the Treasury Department, warning that leaving that kind of money sitting in a government account makes it a “risk for waste, fraud and abuse.”",58,8
WashTimes,CyWlfe0BhBn,2023-10-13 20:46:15,GraphImage,"Children of military service members and civilian defense employees in schools run by the Pentagon led the nation in math and reading last year, improving even after COVID-19 disruptions.",73,7
WashTimes,CyWRJTvyf7C,2023-10-13 17:51:16,GraphVideo,"The media would have it believed that January 6 was a violent insurrection of MAGA supporters who wanted to tear down the halls of Congress, beat up the Democrats and socialists who pretend to be Democrats with sticks and and clubs and the butts of rifles, and viciously assault and attack and injure, even kill, any police officer who dared stand in their way.⁠
⁠
But that’s the lie.⁠
⁠
Check out Bold & Blunt using the link in our bio to learn more.",104,9
WashTimes,CyWHRmbtMGD,2023-10-13 16:22:10,GraphImage,"Facing bipartisan criticism at home, the Biden administration has reportedly put a new hold on some $6 billion in Iranian funds held in a Qatari bank account in the wake of the attack by Palestinian Hamas militants on Israel that has killed more than 1,200 Israelis and foreigners.⁠
⁠
Iran has been a longtime financial and military backer of Hamas, although the U.S. government has said it has seen no evidence yet Iran’s theocratic regime knew of or helped carry out the gruesome weekend attack.",54,1
WashTimes,CyV-Bq2tNio,2023-10-13 15:04:30,GraphVideo,"On Friday's Front Page: House Majority Leader Steve Scalise surprised rank-and-file Republicans by dropping out of the speaker's race, Israel’s military has ramped up its promised campaign of retaliation against Hamas, and more.",45,7
