owner_username,url_code,time_utc,type,caption,likes,comments
WashTimes,Cx_OInvMj-o,2023-10-04 19:02:04,GraphVideo,"Big Business Caught Stealing Away Gun Rights⁠
⁠
Cheryl Chumley and Sen. Ted Cruz discuss on Bold and Blunt.",50,2
WashTimes,Cx_HAXisdvM,2023-10-04 17:57:17,GraphImage,Homeland Security Secretary Alejandro Mayorkas “paroled” the migrants into the country in anticipation of the expiration of the COVID-19 pandemic emergency and the end of the Title 42 border policy. The migrants were released despite a court order blocking parole. A federal judge has demanded that the government report on the migrants’ whereabouts and compliance with their parole terms.,64,6
WashTimes,Cx-1I-ZNdkd,2023-10-04 15:30:38,GraphVideo,"On Wednesday's #FrontPage: House Speaker Kevin McCarthy has been ousted by a handful of hard-right conservatives, throwing the chamber into chaos, Pentagon officials have announced an overhaul of the military’s approach to recruiting, and more.",29,1
WashTimes,Cx-unrFMnEV,2023-10-04 14:24:13,GraphImage,A report released in July by the Government Accountability Office found that 17 of the 24 federal agencies it analyzed used an average of just 25% or less of their headquarters’ office space. The highest average was 49% office usage.,113,17
WashTimes,Cx-ntVPNu2I,2023-10-04 13:24:53,GraphVideo,"#TopoftheTimes: Family sues after an abortion pill caused the death of a Nevada mom.

Tune in as The Washington Times' Tim Constantine discusses today's top stories.",45,1
WashTimes,Cx8fdq7si0X,2023-10-03 17:36:05,GraphVideo,"The conservative-leaning Supreme Court over the past two years has rewritten jurisprudence on guns, race and abortion. It’s about to confront the results of those rulings in its term that began this week. ⁠
⁠
Washington Times legal affairs reporter Alex Swoyer breaks down the cases to watch.",66,3
WashTimes,Cx8Xyy_SRHa,2023-10-03 16:26:19,GraphImage,"“If you’re a Republican or lean Republican, you’re unabashedly wrong, they shut you down,” said Rhonda Baker, 60, of Goldsboro, North Carolina, who voted for former President Donald Trump and has a son in college. “If they hold a rally, it’s: ‘The MAGA’s coming through.’ It’s: ‘The KKK is coming through.’”⁠
⁠",60,5
WashTimes,Cx8QEaTtETg,2023-10-03 15:18:54,GraphVideo,"On Tuesday's #FrontPage: Florida Republican Rep. Matt Gaetz has filed a resolution to remove House Speaker Kevin McCarthy, Pope Francis has suggested blessing same-sex couples, and more.",38,3
WashTimes,Cx8I-92uK-1,2023-10-03 14:16:43,GraphImage,"A Democratic congressman from Texas was the victim of a carjacking in a D.C. neighborhood Monday evening.

Monday’s incident was the second assault on a member of Congress in the District of Columbia this year. In February, Democratic Rep. Angie Craig of Minnesota was assaulted in her Washington apartment building, suffering bruises while escaping serious injury.",94,11
WashTimes,Cx8BMoztXIs,2023-10-03 13:09:58,GraphVideo,"#TopoftheTimes: Newly released documents on Biden family business dealings.

Tune in as The Washington Times' Tim Constantine discusses today's top stories.",29,2
WashTimes,Cx6lWJYMUPi,2023-10-02 23:46:13,GraphImage,"The poll found that 53% of Republican voters say Mr. Trump is a person of faith, making him their top choice.⁠
⁠
That put him slightly ahead in a statistical tie with former Vice President Mike Pence — an evangelical Christian who earned the same description from 52% of GOP survey respondents — and well ahead of his other rivals for the 2024 GOP presidential nomination.",84,18
WashTimes,Cx6cxOdsg9m,2023-10-02 22:31:15,GraphImage,"A network of conservative private investors and state legislators has ranked Florida as the best state, and Massachusetts as the worst, for school choice.⁠
⁠
The American Legislative Exchange Council gave Florida’s K-12 education policies an “A” grade for offering flexible regulations, tax credits and scholarships to parents seeking alternatives to public schooling.",159,20
WashTimes,Cx6VGO2SFf_,2023-10-02 21:24:12,GraphImage,"“Far beyond the financial impact of these crimes, the violence and concerns over safety continue to be the priority for all retailers, regardless of size or category,” the National Retail Federation said in an analysis of the survey findings.⁠
⁠",36,4
WashTimes,Cx6NptRPliT,2023-10-02 20:19:10,GraphImage,"Widespread looting in Philadelphia, some of it coordinated by thieves livestreaming their break-ins on social media, has become a campaign issue for Republicans who say it’s another byproduct of Democrats’ soft-on-crime policies.⁠
⁠
Republican Senate and House candidates in Pennsylvania blame liberal Philadelphia District Attorney Larry Krasner for failing to prioritize property crimes and Democratic lawmakers for supporting “defund the police” efforts.",49,1
WashTimes,Cx6F_zEv2XC,2023-10-02 19:15:06,GraphVideo,"""This trial could have been brought years ago, but they waited till I was right in the middle of my campaign. . . they're all corrupt people. Frankly, our country is corrupt. And that's one of the reasons I'm running,"" said former president Donald Trump.",247,74
WashTimes,Cx5-bqOy_Qf,2023-10-02 18:06:10,GraphImage,"The Supreme Court announced Monday it would not hear a challenge brought by a long-shot Republican presidential candidate John Castro seeking to disqualify former President Donald Trump from holding office over the Jan. 6, 2021, riot at the U.S. Capitol.⁠
⁠
Mr. Castro lost in a lower court on the standing issue in his argument that the Constitution forbids Mr. Trump to hold office following the Capitol riot. He said in his petition to the justices that his campaign would be injured if Mr. Trump remains on the ballot.",398,23
WashTimes,Cx5121Hyib-,2023-10-02 16:51:14,GraphImage,New York Attorney General Letitia James plans to call former President Donald Trump and three of his children to the witness stand in their upcoming civil fraud trial that begins today.,52,8
WashTimes,Cx5toCyt9rh,2023-10-02 15:39:29,GraphVideo,"On today's #FrontPage: Lawmakers on Capitol Hill were able to avert a government shutdown for now, but the intense battle over federal spending hasn’t cooled, the Supreme Court opens its term with justices' nerves still somewhat frayed, and more.",27,1
WashTimes,Cx5i1euMAOj,2023-10-02 14:05:01,GraphImage,"⁠
Justice Sonia Sotomayor seems to have lost respect for her colleagues on the Supreme Court — literally.⁠
⁠
In several of her major dissenting opinions last term, Justice Sotomayor dropped the usual decorum, in which justices write that they “respectfully dissent,” and instead flatly declared, “I dissent.”⁠
⁠
Court observers said it’s a sign of growing frustration from Justice Sotomayor and the high court’s two other Democratic-appointed members, who are limited in their ability to prevail on the big questions of law that are reaching the court with increasing frequency.",251,79
WashTimes,Cx5YFBotksq,2023-10-02 12:32:30,GraphVideo,"#TopoftheTimes: Is there enough evidence to impeach President Biden?

Tune in as The Washington Times' Tim Constantine discusses today's top stories.",26,2
